Date,title,description,url,publishedAt,source,sentiment,relevance
2024-06-19,Block's  ( SQ )  Expanding Partner Base Boosts BNPL Offerings,"Block's (SQ) Afterpay collaborates with several brands to facilitate shopping experience for the United States shoppers, strengthening its ""Buy Now, Pay Later"" offerings.",https://www.zacks.com/stock/news/2290589/blocks-sq-expanding-partner-base-boosts-bnpl-offerings,2024-06-19 16:26:00,Zacks Commentary,0.266722,0.0
2024-06-19,"Starbucks  ( SBUX )  Ties-up Marriott Bonvoy, Boost Loyalty Offerings",Starbucks (SBUX) and Marriott Bonvoy are expanding their loyalty programs to broaden offerings.,https://www.zacks.com/stock/news/2290617/starbucks-sbux-ties-up-marriott-bonvoy-boost-loyalty-offerings,2024-06-19 16:15:00,Zacks Commentary,0.420993,0.0
2024-06-19,Impressive 1st-Quarter Results Spark PayPal's Comeback,"With strong results and innovative AI-driven strategies, the company is staging a powerful comeback • Impressive quarterly results show PayPal's strong financial performance and growth in transaction volumes and revenue. • Launch of PYUSD stablecoin opens new growth opportunities and strengthens ...",https://www.forbes.com/sites/gurufocus/2024/06/19/impressive-1st-quarter-results-spark-paypals-comeback/,2024-06-19 16:42:00,Forbes,0.39904,0.0
2024-06-20,"Why buy now, pay later debt could become a problem for the U.S. economy","Juniper Research estimates that buy now, pay later transactions could reach nearly $700 billion by 2028.",https://www.cnbc.com/2024/06/20/why-buy-now-pay-later-debt-could-become-a-problem-for-us-economy.html,2024-06-20 10:02:01,CNBC,-0.043733,0.0
2024-06-20,SAP BrandVoice: 5 Ways To Hone Your Financial Service Superpowers With GenAI,5 Ways To Hone Your Financial Service Superpowers With GenAI Forbes ...,https://www.forbes.com/sites/sap/2024/06/20/5-ways-to-hone-your-financial-service-superpowers-with-genai/,2024-06-20 08:28:47,Forbes,0.275492,0.0
2024-06-20,"PayPal: Buy, Sell, or Hold?",PayPal stock has never been cheaper. Is it finally time to buy?,https://www.fool.com/investing/2024/06/20/paypal-buy-sell-or-hold/,2024-06-20 08:33:00,Motley Fool,0.230442,0.0
2024-06-20,PayPal Taps Walmart's Srini Venkatesan as New CTO - PayPal Holdings  ( NASDAQ:PYPL ) ,"PayPal Holdings, Inc PYPL has appointed Srini Venkatesan of Walmart Inc WMT as its new Chief Technology Officer ( CTO ) , effective June 24.",https://www.benzinga.com/markets/equities/24/06/39416250/paypal-taps-walmarts-srini-venkatesan-as-new-cto,2024-06-20 15:43:31,Benzinga,0.279466,0.0
2024-06-20,Gynger secures $20 million in Series A funding to revolutionize corporate technology purchasing,"Gynger, the first embedded financing platform for technology purchases, also announced the close of up to $100 million debt facility to fuel its growth as it pioneers the rapidly expanding tech purchasing landscape.",https://www.prnewswire.com/news-releases/gynger-secures-20-million-in-series-a-funding-to-revolutionize-corporate-technology-purchasing-302178152.html,2024-06-20 15:26:00,PR Newswire,0.37576,0.0
2024-06-20,Why the Market Dipped But Paypal  ( PYPL )  Gained Today,"Paypal (PYPL) reachead $59.80 at the closing of the latest trading day, reflecting a +1.15% change compared to its last close.",https://www.zacks.com/stock/news/2291092/why-the-market-dipped-but-paypal-pypl-gained-today,2024-06-20 21:45:17,Zacks Commentary,0.176588,0.0
2024-06-20,Foremost Lithium Announces Application to List on Upstream - A Next Generation Exchange,New Exchange Listing Application to Broaden Access to Global Audience Investing with Digital Currency & Traditional Payments New Exchange Listing Application to Broaden Access to Global Audience Investing with Digital Currency & Traditional Payments ...,https://www.globenewswire.com/news-release/2024/06/20/2901700/0/en/Foremost-Lithium-Announces-Application-to-List-on-Upstream-A-Next-Generation-Exchange.html,2024-06-20 12:31:00,GlobeNewswire,0.215637,0.0
2024-06-20,PayPal Names Srini Venkatesan as Chief Technology Officer,"SAN JOSE, Calif., June 20, 2024 /PRNewswire/ -- PayPal Holdings, Inc. ( NASDAQ: PYPL ) today announced the appointment of Srini Venkatesan as Chief Technology Officer ( CTO ) , effective June 24, reporting to PayPal President and CEO Alex Chriss.",https://www.prnewswire.com/news-releases/paypal-names-srini-venkatesan-as-chief-technology-officer-302177443.html,2024-06-20 12:00:00,PR Newswire,0.412904,0.0
2024-06-20,Bitly Announces Leadership Team Expansion Fueling Innovation And Business Growth,The company has made strategic leadership hires and promotions to enhance customer experience on the Bitly Connections Platform and drive overall success for the business.,https://www.prnewswire.com/news-releases/bitly-announces-leadership-team-expansion-fueling-innovation-and-business-growth-302177300.html,2024-06-20 11:30:00,PR Newswire,0.492912,0.0
2024-06-20,Introducing The 2024 Forbes CMO Hall Of Fame Inductees,"2024 marks the 3rd year and class since we created the Forbes CMO Hall of Fame in 2022, to mark the 10th Anniversary of the Forbes World's Most Influential CMOs list.",https://www.forbes.com/sites/sethmatlins/2024/06/20/introducing-the-2024-forbes-cmo-hall-of-fame-inductees/,2024-06-20 10:30:00,Forbes,0.214418,0.0
2024-06-20,PayPal's Fastlane: A $250M Game-Changer In E-commerce Checkout - PayPal Holdings  ( NASDAQ:PYPL ) ,"PayPal Holdings Inc PYPL is positioning itself to challenge e-commerce giants like Amazon.com Inc AMZN and Shopify Inc SHOP with its innovative Fastlane checkout solution. As Amazon holds 45% of the U.S. e-commerce market and Shopify commands 13%, PayPal is making strategic moves to increase its ...",https://www.benzinga.com/analyst-ratings/analyst-color/24/06/39413243/paypals-fastlane-a-250m-game-changer-in-e-commerce-checkout,2024-06-20 14:00:55,Benzinga,0.396205,0.0
2024-06-20,Nonprofit criticizes Tether in multimillion-dollar ad campaign,Consumers' Protection will bring negative aspects of Tether to consumer attention with billboards and TV ads.,https://cointelegraph.com/news/nonprofit-campaign-targets-tether-stablecoin-risks,2024-06-20 19:23:40,Cointelegraph,0.113763,0.0
2024-06-21,Could This Undervalued Stock Make You a Millionaire One Day?,Investors have soured on this industry-leading enterprise.,https://www.fool.com/investing/2024/06/21/could-undervalued-stock-make-you-millionaire/,2024-06-21 08:16:00,Motley Fool,0.204688,0.0
2024-06-21,"Why PayPal's Comeback Plan Could Take Years, If It Works At All","With its stock down 80% from its pandemic high and its share of online payments slipping, the fintech pioneer and new CEO Alex Chriss need a win.",https://www.forbes.com/sites/jeffkauflin/2024/06/21/why-paypals-comeback-plan-could-take-years-if-it-works-at-all/,2024-06-21 10:30:00,Forbes,0.112077,0.0
2024-06-21,Daily: What's Left For The Supreme Court This Term?,"This is a published version of the Forbes Daily newsletter, you can sign-up to get Forbes Daily in your inbox here. It's peak Supreme Court-watching season. Late June is typically prime time for the highest court in the U.S. to issue its most anticipated decisions.",https://www.forbes.com/sites/sarahwhitmire/2024/06/21/forbes-daily-whats-left-for-the-supreme-court-this-term/,2024-06-21 12:09:36,Forbes,0.105651,0.0
2024-06-21,Could PayPal Stock Double This Year?,PayPal stock is trading at a historically low multiple and deserves your attention.,https://www.fool.com/investing/2024/06/21/could-paypal-stock-double-this-year/,2024-06-21 14:45:57,Motley Fool,-0.085237,0.0
2024-06-22,"The Ultimate Growth Stock to Buy With $3,000 Right Now","This e-commerce outfit is rightfully considered the Amazon of Latin America, but the label understates the actual opportunity.",https://www.fool.com/investing/2024/06/22/the-ultimate-growth-stock-to-buy-with-3000-right-n/,2024-06-22 08:18:00,Motley Fool,0.281635,0.0
2024-06-22,Prediction: These Could Be the Best-Performing Fintech Stocks Through 2030,These three stocks are well off their highs but could have tons of long-term potential.,https://www.fool.com/investing/2024/06/22/prediction-these-could-be-the-best-performing-fint/,2024-06-22 10:18:00,Motley Fool,0.348924,0.0
2024-06-23,Zelle limits at top banks,"AP Buyline's content is created independently of The Associated Press newsroom. Our evaluations and opinions are not influenced by our advertising relationships, but we might earn commissions from our partners' links in this content. Learn more about our policies and terms here .",https://apnews.com/buyline-personal-finance/article/zelle-limits-at-top-banks,2024-06-23 15:23:24,Associated Press,-0.086249,0.0
2024-06-23,How to cash a check without a bank account,"AP Buyline's content is created independently of The Associated Press newsroom. Our evaluations and opinions are not influenced by our advertising relationships, but we might earn commissions from our partners' links in this content. Learn more about our policies and terms here .",https://apnews.com/buyline-personal-finance/article/how-to-cash-a-check-without-a-bank-account,2024-06-23 14:48:17,Associated Press,0.044708,0.0
2024-06-23,Can PayPal Double in 5 Years? Here's What It Would Take,"When a turnaround happens, investors win.",https://www.fool.com/investing/2024/06/23/can-paypal-double-in-5-years-heres-what-it-would/,2024-06-23 12:45:00,Motley Fool,0.209213,0.0
2024-06-24,PayPal's Competitive Pressures In Online Payments Are Increasing: Goldman Sachs - PayPal Holdings  ( NASDAQ:PYPL ) ,Goldman Sachs analyst Will Nance assumed PayPal Holdings PYPL with a Neutral rating and a price target of $69.,https://www.benzinga.com/analyst-ratings/analyst-color/24/06/39462863/paypals-competitive-pressures-in-online-payments-are-increasing-goldman-sachs,2024-06-24 17:18:20,Benzinga,0.142069,0.0
2024-06-24,"Investors Heavily Search PayPal Holdings, Inc.  ( PYPL ) : Here is What You Need to Know","Paypal (PYPL) has received quite a bit of attention from Zacks.com users lately. Therefore, it is wise to be aware of the facts that can impact the stock's prospects.",https://www.zacks.com/stock/news/2292057/investors-heavily-search-paypal-holdings-inc-pypl-here-is-what-you-need-to-know,2024-06-24 13:00:13,Zacks Commentary,0.210755,0.0
2024-06-24,MoneyHero Group Reports First Quarter 2024 Results,"SINGAPORE, June 24, 2024 ( GLOBE NEWSWIRE ) -- ( Nasdaq: ) ( ""MoneyHero"" or the ""Company"" ) , a market leading personal finance and digital insurance aggregation and comparison platform in Greater Southeast Asia, today announced financial results for the quarter ended March 31, 2024.",https://www.globenewswire.com/news-release/2024/06/24/2902886/0/en/MoneyHero-Group-Reports-First-Quarter-2024-Results.html,2024-06-24 11:30:00,GlobeNewswire,0.303847,0.0
2024-06-24,"This résumé got a product manager a $350,000 job at Google and his past roles at Meta, Visa, and PayPal","This résumé got a product manager a $350,000 job at Google - Business Insider ...",https://www.businessinsider.com/how-to-write-big-tech-resume-google-meta-product-manager-2024-6,2024-06-24 00:15:00,Business Insider,0.123367,0.0
2024-06-25,MoneyHero Group Appoints Accomplished Legal and Finance Executive Steve Teichman as Board Director,"SINGAPORE, June 25, 2024 ( GLOBE NEWSWIRE ) -- ( NASDAQ: ) ( ""MoneyHero"" or the ""Company"" ) , the leading personal finance and digital insurance aggregation and comparison platform in Greater Southeast Asia, today announced the appointment of Steve Teichman to its Board of Directors, effective ...",https://www.globenewswire.com/news-release/2024/06/25/2903834/0/en/MoneyHero-Group-Appoints-Accomplished-Legal-and-Finance-Executive-Steve-Teichman-as-Board-Director.html,2024-06-25 13:00:00,GlobeNewswire,0.365782,0.0
2024-06-25,Celsius small business creditors demand reimbursement after 35% cut in claims,Two Celsius creditors have filed a motion asking for a second distribution after they allegedly suffered reduced payments from possessing corporate accounts.,https://cointelegraph.com/news/celsius-small-business-creditors-demand-reimbursement,2024-06-25 13:22:25,Cointelegraph,-0.108472,0.0
2024-06-25,PayPal Holdings's Options Frenzy: What You Need to Know - PayPal Holdings  ( NASDAQ:PYPL ) ,"Whales with a lot of money to spend have taken a noticeably bearish stance on PayPal Holdings. Looking at options history for PayPal Holdings PYPL we detected 17 trades. If we consider the specifics of each trade, it is accurate to state that 35% of the investors opened trades with bullish ...",https://www.benzinga.com/insights/options/24/06/39483557/paypal-holdingss-options-frenzy-what-you-need-to-know,2024-06-25 15:18:16,Benzinga,0.134339,0.0
2024-06-25,Zellerfeld Launches Revolutionary 3D-Printing Footwear Platform,Zellerfeld has been developing cutting-edge 3D-printing technology to redefine industries and place printed shoes on every foot in the world.,https://www.forbes.com/sites/cassellferere/2024/06/25/zellerfeld-launches-revolutionary-3d-printing-footwear-platform/,2024-06-25 16:00:00,Forbes,0.304145,0.0
2024-06-25,1 Undervalued Growth Stock Down 81% You'll Regret Not Buying on the Dip,Macroeconomic tailwinds could work in this beaten-down growth stock's favor as consumer behavior adjusts.,https://www.fool.com/investing/2024/06/25/1-undervalued-growth-stock-down-81-youll-regret-no/,2024-06-25 08:04:00,Motley Fool,-0.400787,0.0
2024-06-26,Exploring Nasdaq: The Digital Stock Market Powerhouse,What Is Nasdaq? an Overview of the Tech-Driven Stock Exchange - Business Insider ...,https://www.businessinsider.com/personal-finance/what-is-nasdaq,2024-06-26 21:55:00,Business Insider,0.179036,0.0
2024-06-26,Is PayPal Stock a Buy?,"Stocks can go nowhere slowly, then leap higher suddenly.",https://www.fool.com/investing/2024/06/26/is-paypal-stock-a-buy/,2024-06-26 13:15:00,Motley Fool,0.307629,0.0
2024-06-26,Paypal  ( PYPL )  Stock Sinks As Market Gains: Here's Why,"Paypal (PYPL) closed at $58.26 in the latest trading session, marking a -1.8% move from the prior day.",https://www.zacks.com/stock/news/2293946/paypal-pypl-stock-sinks-as-market-gains-heres-why,2024-06-26 21:45:18,Zacks Commentary,0.181862,0.0
2024-06-26,Nubank brings Bitcoin Lightning to its 100M Latin American customers,"Lightspark will also integrate the Universal Money Address standard for Nubank, which gives an email-like address for users to send and receive money.",https://cointelegraph.com/news/lightspark-nubank-offer-bitcoin-lightning-latin-america,2024-06-26 00:23:43,Cointelegraph,0.132252,0.0
2024-06-26,The former executive assistant to a tech CEO found decapitated in a Manhattan apartment in 2020 has been convicted of murder,"The former executive assistant of a tech CEO was found guilty Monday of murdering his boss - whom he then decapitated and dismembered - in 2020, according to a news release from the Manhattan District Attorney's Office.",https://www.cnn.com/2024/06/25/us/new-york-tech-ceo-murder-conviction/index.html,2024-06-26 00:23:00,CNN,-0.194046,0.0
2024-06-26,Julian Assange's Family Is Raising Funds For Him With Bitcoin,"It's a global headline - Julian Assange, the former editor-in-chief of Wikileaks, has been granted a plea deal and his sentence has been commuted to time served. His next move is to travel to Saipan and then back to his homeland, Australia.",https://www.forbes.com/sites/digital-assets/2024/06/25/julian-assanges-family-is-raising-funds-for-him-with-bitcoin/,2024-06-26 00:19:23,Forbes,0.121131,0.0
2024-06-26,"Here's How Much Bitcoin Has Surged Since Julian Assange's WikiLeaks Took Refuge In The Cryptocurrency After Visa, MasterCard and PayPal Pulled The Plug","WikiLeaks founder Julian Assange, is set to return to his home country Australia as his long-running legal struggle with the U.S. government comes to a close. As he walks out as a ""free man,"" we examine the famed whistleblower's connections to Bitcoin BTC/USD and how the digital currency came to ...",https://www.benzinga.com/markets/cryptocurrency/24/06/39498400/heres-how-much-bitcoin-has-surged-since-julian-assanges-wikileaks-took-refuge-in-the-crypt,2024-06-26 11:21:56,Benzinga,0.137048,0.0
2024-06-26,Nvidia Stock Still Falling as Shareholder Meeting Concludes,Nvidia Stock Falls as Shareholder Meeting Concludes ...,https://www.barrons.com/amp/articles/nvidia-shareholder-meeting-stock-price-today-6d01b66c,2024-06-26 17:08:00,Barrons,0.181717,0.0
2024-06-27,Here Are Biden's Top 10 Biggest Billionaire Donors,Biden's Top Billionaire Donors Are Richer Than Trump's But Not As Generous Forbes ...,https://www.forbes.com/sites/leokamin/2024/06/27/here-are-bidens-top-10-biggest-billionaire-donors-bloomberg-reid-hoffman/,2024-06-27 10:30:00,Forbes,0.209841,0.0
2024-06-27,"Nvidia Briefly Overtook Microsoft As World's Most Valuable Company Last Week, But Since Then Jensen Huang-Led AI Stalwart Has Lost Nearly $500B Investor Money: Here's What Happened - Microsoft  ( NASDAQ:MSFT ) , NVIDIA  ( NASDAQ:NVDA ) ","Last week, Nvidia Corp. NVDA momentarily outpaced Microsoft Corp. MSFT to become the world's most valuable company. However, the top spot was short-lived and the chip-making behemoth has since seen a staggering loss of investor money.",https://www.benzinga.com/markets/equities/24/06/39524544/nvidia-briefly-overtook-microsoft-as-worlds-most-valuable-company-last-week-but-since-then-jense,2024-06-27 13:03:31,Benzinga,0.143963,0.0
2024-06-27,Unicorn founder backs Multipolitan's pre-seed round,"Multipolitan's pioneering platform transforms global mobility, empowering individuals to explore, live, work and thrive anywhere in the world.",https://www.prnewswire.com/apac/news-releases/unicorn-founder-backs-multipolitans-pre-seed-round-302184737.html,2024-06-27 23:30:00,PR Newswire,0.376582,0.0
2024-06-28,Missed Out on Visa? Buy PayPal Instead,The payments sector has proven to be a lucrative investment area.,https://www.fool.com/investing/2024/06/28/missed-out-on-visa-buy-paypal-instead/,2024-06-28 09:15:00,Motley Fool,0.33948,0.0
2024-06-28,"2 Cheap Growth Stocks to Buy Before They Soar 175% and 495%, According to Certain Wall Street Analysts",Price targets set by these Wall Street analysts imply big upside for UiPath and Block shareholders.,https://www.fool.com/investing/2024/06/28/2-cheap-growth-stocks-buy-before-soar-495-wall-st/,2024-06-28 11:45:32,Motley Fool,0.277579,0.0
2024-06-28,Julian Assange Bitcoin donation shows how crypto can support transparency,"The Bitcoin community came to Julian Assange's aid, helping ensure the WikiLeaks founders' safe and debt-free return to Australia.",https://cointelegraph.com/news/julian-assange-bitcoin-donation,2024-06-28 14:00:00,Cointelegraph,0.029434,0.0
2024-06-28,"PayPal's New Leadership and Strategy Poised to Drive Profitable Growth, Analyst Says - PayPal Holdings  ( NASDAQ:PYPL ) ","RBC Capital analyst Daniel Perlin reiterated PayPal Holdings Inc PYPL with an Outperform and a $84 price target. PayPal has called out fiscal 2024 as a transition year to set the company up for long-term profitable growth, Perlin noted.",https://www.benzinga.com/analyst-ratings/analyst-color/24/06/39555108/paypals-new-leadership-and-strategy-poised-to-drive-profitable-growth-analyst-says,2024-06-28 17:29:42,Benzinga,0.338608,0.0
2024-06-28,"Crypto Biz: Jump Crypto exec steps down, first MiCA deadline looms, and more","This week's Crypto Biz explores the departure of Jump Crypto's CEO, Animoca Brands' return to public markets, the corporate dispute between Riot and Bitfarms, and other news.",https://cointelegraph.com/news/crypto-biz-jump-crypto-exec-steps-down-first-mica-deadline-looms,2024-06-28 21:00:00,Cointelegraph,-0.030838,0.0
2024-06-29,"Bitcoin's price won't 'dramatically' increase from here, says billionaire","Peter Thiel also believes that Bitcoin's original vision as a cypherpunk, crypto-anarchist, freedom tool hasn't been fulfilled.",https://cointelegraph.com/news/bitcoin-future-price-wont-dramatically-increase-says-peter-thiel,2024-06-29 01:14:53,Cointelegraph,0.033001,0.0
2024-07-16,Trump Lands More Big Tech Backers: Billionaire Venture Capitalist Andreessen Joins Wave Supporting Former President,"Prominent venture capitalists Marc Andreessen and Ben Horowitz both intend to donate to political action committees supporting former President Donald Trump, several outlets reported Tuesday, becoming the latest technology titans to back Trump's reelection bid.",https://www.forbes.com/sites/dereksaul/2024/07/16/trump-lands-more-big-tech-backers-billionaire-venture-capitalist-andreessen-joins-wave-supporting-former-president/,2024-07-16 19:58:06,Forbes,0.265165,0.0
2024-07-16,Growth Stocks To Buy And Watch: See Updates To IBD Stock Lists,"Where can you find the best growth stocks to buy and watch? Start by checking the IBD 50, IBD Sector Leaders, IBD Big Cap 20, IPO Leaders and Stock Spotlight. You'll also find stocks like Microsoft ( MSFT ) , ServiceNow ( NOW ) and PayPal ( PYPL ) whose track records of stable earnings growth ...",https://www.investors.com/research/best-growth-stocks-buy-watch-ibd-stock-lists/,2024-07-16 22:49:00,Investors Business Daily,0.37824,0.0
2024-07-17,3 Absurdly Cheap Stocks to Buy and Hold for Years,You can buy these solid stocks at some attractive discounts right now.,https://www.fool.com/investing/2024/07/17/3-absurdly-cheap-stocks-to-buy-and-hold-for-years/,2024-07-17 12:25:00,Motley Fool,0.397238,0.0
2024-07-17,5 Technology Stocks Poised to Beat Earnings Estimates in Q2,"Here, we have picked five tech stocks, Arista Networks (ANET), Corning (GLW), PayPal (PYPL), Paycom Software (PAYC) and Twilio (TWLO), which are likely to pull off earnings surprises in second-quarter 2024.",https://www.zacks.com/stock/news/2303601/5-technology-stocks-poised-to-beat-earnings-estimates-in-q2,2024-07-17 14:54:00,Zacks Commentary,0.206774,0.0
2024-07-17,Garmin  ( GRMN )  Expands Marine Portfolio With MM55 & 55-HR Devices,Garmin (GRMN) unveils JL Audio MM55 and 55-HR next-generation marine and powersports source units in a bid to strengthen its overall portfolio.,https://www.zacks.com/stock/news/2303697/garmin-grmn-expands-marine-portfolio-with-mm55-55-hr-devices,2024-07-17 15:50:00,Zacks Commentary,0.364916,0.0
2024-07-17,"Garmin Expands Marine Portfolio With MM55 & 55-HR Devices - Garmin  ( NYSE:GRMN ) , Badger Meter  ( NYSE:BMI ) ",Garmin GRMN launched the JL Audio MediaMaster 55 and 55-HR next-generation marine and powersports source units.,https://www.benzinga.com/news/earnings/24/07/39821625/garmin-expands-marine-portfolio-with-mm55-55-hr-devices,2024-07-17 18:34:27,Benzinga,0.384039,0.0
2024-07-17,"State Street eyes blockchain leap with stablecoin, deposit token: Report",The global asset manager may be on its way to the forefront of settlement technology.,https://cointelegraph.com/news/state-street-blockchain-stablecoin-digital-cash-plans,2024-07-17 20:41:48,Cointelegraph,0.289172,0.0
2024-07-17,Paypal  ( PYPL )  Stock Moves -0.92%: What You Should Know,"Paypal (PYPL) closed at $61.24 in the latest trading session, marking a -0.92% move from the prior day.",https://www.zacks.com/stock/news/2303907/paypal-pypl-stock-moves--092-what-you-should-know,2024-07-17 21:45:21,Zacks Commentary,0.212574,0.0
2024-07-17,"Trump's got big problems with Big Tech, and Zuckerberg is at the top of his list right now",Trump has big problems with big tech - Business Insider ...,https://www.businessinsider.com/trump-seriously-hates-mark-zuckerberg-2024-7,2024-07-17 08:43:00,Business Insider,0.007367,0.0
2024-07-18,"The Zacks Analyst Blog Arista Networks, Corning, PayPal, Paycom and Twilio","Arista Networks, Corning, PayPal, Paycom and Twilio are included in this Analyst Blog.",https://www.zacks.com/stock/news/2304057/the-zacks-analyst-blog-arista-networks-corning-paypal-paycom-and-twilio,2024-07-18 08:55:00,Zacks Commentary,0.211133,0.0
2024-07-18,How to Find Strong Computer and Technology Stocks Slated for Positive Earnings Surprises,Investors looking for ways to find stocks that are set to beat quarterly earnings estimates should check out the Zacks Earnings ESP.,https://www.zacks.com/stock/news/2304184/how-to-find-strong-computer-and-technology-stocks-slated-for-positive-earnings-surprises,2024-07-18 12:50:11,Zacks Commentary,0.396742,0.0
2024-07-18,"Block's Cash App to Exit UK Market, Stock Drops - Block  ( NYSE:SQ ) ","Block Inc SQ announced that its consumer-payments platform, Cash App, will cease operations in the U.K. on September 15, six years after launching there. The platform, known for its mobile money transfers, was the company's first international market when it debuted in 2018.",https://www.benzinga.com/news/24/07/39847273/blocks-cash-app-to-exit-uk-market-stock-drops,2024-07-18 19:18:27,Benzinga,0.279784,0.0
2024-07-19,What's in the Offing for Logitech  ( LOGI )  This Earnings Season?,"The improving demand for PCs, the main sales booster for its PC peripheral products, and inventory normalization at channel partners are likely to have aided Logitech's (LOGI) Q1 earnings.",https://www.zacks.com/stock/news/2305156/whats-in-the-offing-for-logitech-logi-this-earnings-season,2024-07-19 13:30:00,Zacks Commentary,0.238384,0.0
2024-07-19,A Closer Look at PayPal Holdings's Options Market Dynamics - PayPal Holdings  ( NASDAQ:PYPL ) ,"Whales with a lot of money to spend have taken a noticeably bullish stance on PayPal Holdings. Looking at options history for PayPal Holdings PYPL we detected 8 trades. If we consider the specifics of each trade, it is accurate to state that 50% of the investors opened trades with bullish ...",https://www.benzinga.com/insights/options/24/07/39860692/a-closer-look-at-paypal-holdingss-options-market-dynamics,2024-07-19 14:17:19,Benzinga,0.207421,0.0
