Date,title,description,url,publishedAt,source,sentiment,relevance
2024-11-15,Peter Thiel Says Elon Musk's Support For Trump Paved The Way For Other Silicon Valley Leaders To Back Him: 'Incredibly Courageous',"A realignment has taken shape in Silicon Valley, with Tesla Inc. CEO Elon Musk's support for President-elect Donald Trump encouraging other tech leaders to publicly embrace conservative positions, according to PayPal co-founder Peter Thiel.",https://www.benzinga.com/markets/24/11/42002872/peter-thiel-says-elon-musks-support-for-donald-trump-paved-the-way-for-other-silicon-valley-leaders-to-ba,2024-11-15 10:30:23,Benzinga,0.31044,0.0
2024-11-15,3 Things You Need to Know If You Buy PayPal Stock Today,Shares of the fintech enterprise have surged in the past few months.,https://www.fool.com/investing/2024/11/15/3-things-you-need-to-know-if-you-buy-paypal-stock/,2024-11-15 12:00:00,Motley Fool,0.269776,0.0
2024-11-15,Activist Investor Nelson Peltz Says He Was 'A Matchmaker' For Elon Musk With Donald Trump,Billionaire activist investor Nelson Peltz claimed he played a crucial role in introducing Elon Musk to Donald Trump. This connection reportedly led to Musk's significant support for Trump's presidential campaign.,https://www.benzinga.com/news/24/11/42006982/activist-investor-nelson-peltz-says-he-was-a-matchmaker-for-elon-musk-with-donald-trump,2024-11-15 13:04:44,Benzinga,0.369627,0.0
2024-11-15,"Here is What to Know Beyond Why PayPal Holdings, Inc.  ( PYPL )  is a Trending Stock","Paypal (PYPL) has received quite a bit of attention from Zacks.com users lately. Therefore, it is wise to be aware of the facts that can impact the stock's prospects.",https://www.zacks.com/stock/news/2370920/here-is-what-to-know-beyond-why-paypal-holdings-inc-pypl-is-a-trending-stock,2024-11-15 14:00:14,Zacks Commentary,0.248449,0.0
2024-11-16,2 Stocks That Could Crush the Market in 2025,"2025 is getting closer, and investors need to start thinking about how they want their portfolios positioned headed into the new year. Fund managers often make big changes before the new year, which can ignite a ""Santa Claus rally."" This effect pushes stock prices up in December, so individual ...",https://www.fool.com/investing/2024/11/16/2-stocks-that-could-crush-the-market-in-2025/,2024-11-16 12:30:00,Motley Fool,0.261194,0.0
2024-11-19,Behind the Scenes of PayPal Holdings's Latest Options Trends - PayPal Holdings  ( NASDAQ:PYPL ) ,"Financial giants have made a conspicuous bullish move on PayPal Holdings. Our analysis of options history for PayPal Holdings PYPL revealed 9 unusual trades. Delving into the details, we found 44% of traders were bullish, while 33% showed bearish tendencies.",https://www.benzinga.com/insights/options/24/11/42066847/behind-the-scenes-of-paypal-holdingss-latest-options-trends,2024-11-19 15:46:11,Benzinga,0.210799,0.0
2024-11-20,Can SQ's Expanding Footprint in BNPL Domain Push the Stock Higher?,Block's expanding partner base and strong positioning in the digital payments industry are driving prospects despite stiff competition and stretched valuation.,https://www.zacks.com/stock/news/2372849/can-sqs-expanding-footprint-in-bnpl-domain-push-the-stock-higher,2024-11-20 15:24:00,Zacks Commentary,0.308298,0.0
2024-11-20,Bitfarms Announces Results of Special Meeting of Shareholders,"- Bitfarms Board of Directors Increased to Six Members, Five of whom are Independent --Andrew J. Chang Appointed as Independent Director--Shareholder Rights Plan ...",https://www.globenewswire.com/news-release/2024/11/20/2984844/0/en/Bitfarms-Announces-Results-of-Special-Meeting-of-Shareholders.html,2024-11-20 23:00:00,GlobeNewswire,0.203336,0.0
2024-11-20,"Bitfarms Announces Results of Special Meeting of Shareholders - Bitfarms  ( NASDAQ:BITF ) , Stronghold Digital Mining  ( NASDAQ:SDIG ) ","- Bitfarms Board of Directors Increased to Six Members, Five of whom are Independent - -Andrew J. Chang Appointed as Independent Director- -Shareholder Rights Plan Approved-",https://www.benzinga.com/pressreleases/24/11/g42101111/bitfarms-announces-results-of-special-meeting-of-shareholders,2024-11-20 23:00:41,Benzinga,0.191635,0.0
2024-11-21,"CFPB expands oversight of digital payments services including Apple Pay, Cash App and PayPal","The most popular apps covered by the rule collectively process more than 13 billion consumer payments a year, the CFPB said.",https://www.cnbc.com/2024/11/21/cfpb-expands-oversight-of-apple-pay-other-digital-payments-services.html,2024-11-21 13:58:14,CNBC,0.124189,0.0
2024-11-21,"The New Economy: What Does Bitcoin's Meteoric Rise Bode? Crossroads Summit 2024, Just Days Away, Offers Insight From Industry Leaders And Experts - Mastercard  ( NYSE:MA ) , JPMorgan Chase  ( NYSE:JPM ) ","Nearly 16 years have passed since the elusive Satoshi Nakamoto mined Bitcoin's genesis block on Jan. 3, 2009, launching what would become the largest and most popular cryptocurrency.",https://www.benzinga.com/partner/cryptocurrency/24/11/42110916/the-new-economy-what-does-bitcoins-meteoric-rise-bode-crossroads-summit-2024-just-days-awa,2024-11-21 13:28:46,Benzinga,0.207505,0.0
2024-11-21,"European Stability May Improve With Trump's 'Peace Through Strength' Policy - PayPal Holdings  ( NASDAQ:PYPL ) , Palantir Technologies  ( NYSE:PLTR ) ","European geopolitical stability may improve during the next Trump administration, despite concerns about the upcoming US president's impact on global security.",https://www.benzinga.com/general/market-summary/24/11/42117093/european-stability-may-improve-with-trumps-peace-through-strength-policy,2024-11-21 16:20:15,Benzinga,0.03206,0.0
2024-11-21,"3 Stocks That Could Turn $1,000 into $5,000 by 2030",These three stocks are reporting rapid growth and have the potential to multiply your portfolio's value.,https://www.fool.com/investing/2024/11/21/3-stocks-that-could-turn-1000-into-5000-by-2030/,2024-11-21 11:45:00,Motley Fool,0.360784,0.0
2024-11-21,SilentSwap Introduces Privacy-Focused DEX Aggregator on Secret Network,"NEW YORK, Nov. 22, 2024 ( GLOBE NEWSWIRE ) -- The global financial landscape faces growing concerns over censorship and restricted access, with centralized institutions retaining the ability to freeze accounts and block transactions.",https://www.benzinga.com/pressreleases/24/11/g42123783/silentswap-introduces-privacy-focused-dex-aggregator-on-secret-network,2024-11-21 21:17:49,Benzinga,0.165853,0.0
2024-11-22,'I have no money': Thousands of Americans see their savings vanish in Synapse fintech crisis,"CNBC spoke to a dozen customers caught in the Synapse fintech predicament, people who are owed sums ranging from $7,000 to well over $200,000.",https://www.cnbc.com/2024/11/22/synapse-bankruptcy-thousands-of-americans-see-their-savings-vanish.html,2024-11-22 15:00:01,CNBC,-0.009661,0.0
2024-11-22,Behind the Scenes of PayPal Holdings's Latest Options Trends - PayPal Holdings  ( NASDAQ:PYPL ) ,"Whales with a lot of money to spend have taken a noticeably bullish stance on PayPal Holdings. Looking at options history for PayPal Holdings PYPL we detected 22 trades. If we consider the specifics of each trade, it is accurate to state that 50% of the investors opened trades with bullish ...",https://www.benzinga.com/insights/options/24/11/42142799/behind-the-scenes-of-paypal-holdingss-latest-options-trends,2024-11-22 16:51:35,Benzinga,0.204667,0.0
2024-11-22,4 Monster Stocks to Hold for the Next 10 Years -- Including Nvidia,Nvidia isn't the only amazing stock performer out there.,https://www.fool.com/investing/2024/11/22/4-monster-stocks-to-hold-for-the-next-10-years/,2024-11-22 13:00:00,Motley Fool,0.281156,0.0
2024-11-23,"Up 25% in the Past 3 Months, Is PayPal Stock a No-Brainer Buy That Can Double in 5 Years?","PayPal ( NASDAQ: PYPL ) is a leader in the electronic payments niche of the broader financial services industry but hasn't been too kind to investors in recent years. Shares currently trade at an alarming 73% off their peak, which was established in July 2021.However, there's been a renewed sense ...",https://www.fool.com/investing/2024/11/23/up-25-3-months-paypal-stock-no-brainer-double/,2024-11-23 08:30:00,Motley Fool,0.355604,0.0
2024-11-23,Should You Buy PayPal Stock While It's Below $87?,The aging fintech leader still faces plenty of long-term challenges.,https://www.fool.com/investing/2024/11/23/should-you-buy-paypal-stock-while-its-below-87/,2024-11-23 18:25:00,Motley Fool,0.110852,0.0
2024-12-10,1 Warren Buffett Stock That Has Historically Been a Big Winner: Is It Headed Higher?,"Since Visa's ( NYSE: V ) initial public offering in March 2008, its shares have produced a total return ( including reinvested dividends ) of 2,380%. That tremendous performance absolutely trounced the 552% total return that the S&P 500 index generated during the same period.",https://www.fool.com/investing/2024/12/10/warren-buffett-stock-winner-headed-higher/,2024-12-10 11:30:00,Motley Fool,0.300627,0.0
2024-12-10,Coinbase Global and Ford Motor have been highlighted as Zacks Bull and Bear of the Day,"Chicago, IL - December 10, 2024 - Zacks Equity Research shares Coinbase Global ( COIN Quick QuoteCOIN - ) as the Bull of the Day and Ford Motor Company ( F Quick QuoteF - ) as the Bear of the Day.",https://www.zacks.com/stock/news/2381354/coinbase-global-and-ford-motor-have-been-highlighted-as-zacks-bull-and-bear-of-the-day,2024-12-10 13:25:00,Zacks Commentary,0.261398,0.0
2024-12-10,4 Brilliant Growth Stocks to Buy Now and Hold for the Long Term -- Including Nvidia,"Over many decades, the stock market has averaged annual returns of close to 10%. That's pretty good! ( Of course, over shorter periods, it can average much more -- or less. ) It makes good sense for most investors to park much, if not most, of their moola in one or more simple, low-fee index ...",https://www.fool.com/investing/2024/12/10/4-brilliant-growth-stocks-to-buy-now-and-hold-for/,2024-12-10 13:26:15,Motley Fool,0.38651,0.0
2024-12-10,The PayPal Mafia is taking over America's government,America's right-wing tech bros are celebrating Donald Trump's victory ...,https://www.economist.com/business/2024/12/10/the-paypal-mafia-is-taking-over-americas-government,2024-12-10 17:55:20,The Economist,0.113489,0.0
2024-12-11,Latest Aerospike Vector Search Keeps Data Fresh for Accurate GenAI and ML Decisions Regardless of Scale,"MOUNTAIN VIEW, Calif., Dec. 11, 2024 ( GLOBE NEWSWIRE ) -- Aerospike Inc. ( ""Aerospike"" ) today unveiled the latest version of Aerospike Vector Search, featuring powerful new indexing and storage innovations that deliver real-time accuracy, scalability, and ease of use for developers.",https://www.benzinga.com/pressreleases/24/12/g42431327/latest-aerospike-vector-search-keeps-data-fresh-for-accurate-genai-and-ml-decisions-regardless-of-,2024-12-11 10:00:00,Benzinga,0.223894,0.0
2024-12-12,Affirm Gains 42% Year to Date: Should You Buy Now or Hold the Stock?,"AFRM harnesses AI-driven innovation, strategic alliances and rising BNPL demand to expand its footprint.",https://www.zacks.com/stock/news/2383014/affirm-gains-42-year-to-date-should-you-buy-now-or-hold-the-stock,2024-12-12 18:02:00,Zacks Commentary,0.353578,0.0
2024-12-12,Price Over Earnings Overview: PayPal Holdings - PayPal Holdings  ( NASDAQ:PYPL ) ,"In the current market session, PayPal Holdings Inc. PYPL stock price is at $90.43, after a 0.35% drop. However, over the past month, the company's stock went up by 4.63%, and in the past year, by 46.52%.",https://www.benzinga.com/insights/news/24/12/42470831/price-over-earnings-overview-paypal-holdings,2024-12-12 20:15:20,Benzinga,0.08324,0.0
2024-12-12,Why Is Shopify  ( SHOP )  Up 2% Since Last Earnings Report?,Shopify (SHOP) reported earnings 30 days ago. What's next for the stock? We take a look at earnings estimates for some clues.,https://www.zacks.com/stock/news/2382932/why-is-shopify-shop-up-2-since-last-earnings-report,2024-12-12 16:30:29,Zacks Commentary,0.242559,0.0
2024-12-12,Paypal  ( PYPL )  Registers a Bigger Fall Than the Market: Important Facts to Note,"The latest trading day saw Paypal (PYPL) settling at $89.40, representing a -1.49% change from its previous close.",https://www.zacks.com/stock/news/2383055/paypal-pypl-registers-a-bigger-fall-than-the-market-important-facts-to-note,2024-12-12 22:45:20,Zacks Commentary,0.148293,0.0
2024-12-12,Adobe  ( ADBE )  Q4 2024 Earnings Call Transcript,"ADBE earnings call for the period ending September 30, 2024.",https://www.fool.com/earnings/call-transcripts/2024/12/11/adobe-adbe-q4-2024-earnings-call-transcript/,2024-12-12 02:30:16,Motley Fool,0.308555,0.0
2024-12-12,US bankers cautious about crypto amid expectations of regulatory easing,Goldman Sachs CEO David Solomon said the Wall Street giant would 'evaluate' dealing in top cryptocurrencies like bitcoin and ether if rules change.,https://www.scmp.com/tech/blockchain/article/3290431/us-bankers-cautious-about-crypto-amid-expectations-regulatory-easing-under-trump,2024-12-12 03:40:42,South China Morning Post,0.058036,0.0
2024-12-13,"Buy now, pay later company Affirm strikes $4 billion loan deal with private credit firm Sixth Street",Affirm Holdings is getting its largest-ever capital commitment with a new partnership from private-credit firm Sixth Street.,https://www.cnbc.com/2024/12/13/buy-now-pay-later-company-affirm-strikes-4-billion-loan-deal-with-private-credit-firm-sixth-street.html,2024-12-13 13:50:07,CNBC,0.140641,0.0
2024-12-13,MoneyHero Group Announces Resignation of Chief Financial Officer - MoneyHero  ( NASDAQ:MNY ) ,"Senior finance executive Danny Leung, the Company's Group Finance Director, named interim CFO MoneyHero launches formal search process for its next permanent CFO, supported by leading global executive search advisors",https://www.benzinga.com/pressreleases/24/12/g42483840/moneyhero-group-announces-resignation-of-chief-financial-officer,2024-12-13 14:00:00,Benzinga,0.314709,0.0
2024-12-13,MoneyHero Group Announces Resignation of Chief Financial Officer,cfo resignation ...,https://www.globenewswire.com/news-release/2024/12/13/2996837/0/en/MoneyHero-Group-Announces-Resignation-of-Chief-Financial-Officer.html,2024-12-13 14:00:00,GlobeNewswire,0.329118,0.0
2024-12-13,"This PayPal Analyst Turns Bullish; Here Are Top 5 Upgrades For Friday - Ciena  ( NYSE:CIEN ) , Cardinal Health  ( NYSE:CAH ) ","Top Wall Street analysts changed their outlook on these top names. For a complete view of all analyst rating changes, including upgrades and downgrades, please see our analyst ratings page. Wolfe Research analyst Darrin Peller upgraded the rating for PayPal Holdings, Inc.",https://www.benzinga.com/24/12/42484987/this-paypal-analyst-turns-bullish-here-are-top-5-upgrades-for-friday,2024-12-13 14:50:09,Benzinga,0.373662,0.0
2024-12-13,UPDATE - MoneyHero Group Announces Resignation of Chief Financial Officer,cfo resignation ...,https://www.globenewswire.com/news-release/2024/12/13/2996879/0/en/UPDATE-MoneyHero-Group-Announces-Resignation-of-Chief-Financial-Officer.html,2024-12-13 14:53:00,GlobeNewswire,0.332988,0.0
2024-12-13,UPDATE - MoneyHero Group Announces Resignation of Chief Financial Officer - MoneyHero  ( NASDAQ:MNY ) ,"Senior finance executive Danny Leung, the Company's Group Finance Director, named interim CFO MoneyHero launches formal search process for its next permanent CFO, supported by leading global executive search advisors",https://www.benzinga.com/pressreleases/24/12/g42485108/update-moneyhero-group-announces-resignation-of-chief-financial-officer,2024-12-13 14:53:41,Benzinga,0.312539,0.0
2024-12-13,THE HISPANIC STAR GALA GATHERED THE MOST IMPORTANT LATINOS AND ALLIES IN THE COUNTRY IN NYC,"The exclusive event honored Martin Cabrera, CEO & Founder of Cabrera Capital, NBC's Universal Cesar Conde, award-winning journalist Maria Hinojosa andSports Icon and Equality Champions Billie Jean King, alongside Rosie Casals, Founder & President of Sportswomen, Inc.",https://www.benzinga.com/pressreleases/24/12/n42486514/the-hispanic-star-gala-gathered-the-most-important-latinos-and-allies-in-the-country-in-nyc,2024-12-13 15:39:00,Benzinga,0.380169,0.0
2024-12-13,"Coinbase Europe Delists USDT, Other Stablecoins Citing EU Compliance",Coinbase pointed out that USD Coin (USDC) and EUR Coin (EURC) are MiCA-compliant and will continue to be supported.,https://decrypt.co/296453/coinbase-europe-delists-usdt,2024-12-13 15:39:43,Decrypt.co,0.004783,0.0
2024-12-13,Donald Trump Pledges To 'Do Something Great With Crypto'-Here's What He's Done So Far,"President-elect Donald Trump on Thursday declared his intention to ""do something great with crypto,"" signaling a significant shift in U.S. policy on digital assets. Trump emphasized the need for the United States to stay ahead of global competitors, particularly China, in embracing cryptocurrency.",https://www.benzinga.com/markets/cryptocurrency/24/12/42480856/donald-trump-pledges-to-do-something-great-with-crypto-heres-what-hes-done-so-far,2024-12-13 11:43:49,Benzinga,0.374281,0.0
2024-12-13,Jim Cramer's top 10 things to watch in the stock market Friday,The takeaway from Broadcom's earnings: There's insatiable demand for AI chips from the tech titans.,https://www.cnbc.com/2024/12/13/jim-cramers-top-10-things-to-watch-in-the-stock-market-friday.html,2024-12-13 13:47:13,CNBC,0.274637,0.0
2024-12-14,Here Are My Top 10 Stocks for 2025,"With 2025 approaching, it's time to start thinking about what stocks to add to your portfolio. While I'm a proponent of a well-diversified portfolio, I see a lot of potential in the tech realm right now, especially with how big artificial intelligence ( AI ) is becoming.If you're looking for a ...",https://www.fool.com/investing/2024/12/14/here-are-my-top-10-stocks-for-2025/,2024-12-14 12:00:00,Motley Fool,0.221265,0.0
2024-12-14,3 Things You Need to Know If You Buy Block Stock Today,"Investors are likely familiar with Block ( NYSE: SQ ) , the budding payments and technology enterprise. It caters to merchants with its Square platform, while Cash App targets individuals.Growth has been outstanding historically, but the fintech stock hasn't panned out as hoped.",https://www.fool.com/investing/2024/12/14/3-things-need-to-know-buy-block-stock-today/,2024-12-14 11:25:00,Motley Fool,0.352113,0.0
2024-12-14,Peter Thiel Believes Elon Musk's DOGE Initiative Is The Answer To Avoiding Massive Tax Hikes: Tesla CEO Says He Is 'Right On All Counts',"Peter Thiel has voiced his support for the Elon Musk-led Department of Government Efficiency initiative, suggesting it could be a key strategy to prevent significant tax increases.",https://www.benzinga.com/tech/24/12/42495659/peter-thiel-believes-elon-musks-doge-initiative-is-the-answer-to-avoiding-massive-tax-hikes-tesla-ceo-says-h,2024-12-14 07:20:25,Benzinga,0.235535,0.0
2024-12-15,"Bitcoin Climbs to $105,000 as Trump Trade Continues to Drive Assets Higher","Bitcoin is posting new highs, bolstered by various tailwinds, including market reactions to President-elect Donald Trump.",https://decrypt.co/296686/bitcoin-climbs-to-105000-as-trump-trade-continues-to-drive-assets-higher,2024-12-15 23:52:02,Decrypt.co,0.251824,0.0
2024-12-15,Will Artificial Intelligence Stocks Continue to Dominate in 2025? Here's What History Says.,"Artificial intelligence stocks have helped propel the markets to all-time highs, but can the momentum really keep going?",https://www.fool.com/investing/2024/12/15/will-artificial-intelligence-stocks-continue-to-do/,2024-12-15 17:05:00,Motley Fool,0.204187,0.0
2024-12-16,Is PayPal an Undervalued Growth Stock to Buy?,"PayPal ( NASDAQ: PYPL ) is adding millions of new accounts while increasing engagement from existing users.*Stock prices used were the afternoon prices of Dec. 12, 2024. The video was published on Dec. 14, 2024.Continue reading ...",https://www.fool.com/investing/2024/12/16/is-paypal-an-undervalued-growth-stock-to-buy/,2024-12-16 15:42:04,Motley Fool,-0.373732,0.0
2024-12-16,Here's How The Fed's Anticipated Rate Cut Could Impact Crypto,"The Federal Reserve is expected to cut rates this week, though analysts don't see much of a crypto price bump immediately following.",https://decrypt.co/296707/heres-how-the-feds-anticipated-rate-cut-could-impact-crypto,2024-12-16 05:27:30,Decrypt.co,0.108818,0.0
2024-12-16,"Cryptocurrency Market to grow by USD 34.5 Billion  ( 2024-2028 ) , driven by rising investments in digital assets, Report on AI's impact on market trends - Technavio","NEW YORK, Dec. 15, 2024 /PRNewswire/ -- Report on how AI is redefining market landscape - The global cryptocurrency market size is estimated to grow by USD 34.5 billion from 2024-2028, according to Technavio. The market is estimated to grow at a CAGR of 16.64% during the forecast period.",https://www.benzinga.com/pressreleases/24/12/n42500830/cryptocurrency-market-to-grow-by-usd-34-5-billion-2024-2028-driven-by-rising-investments-in-digita,2024-12-16 02:39:00,Benzinga,0.286431,0.0
2024-12-17,1 Undervalued Growth Stock Down 71% to Buy Before 2025,"This growth stock is an attractive option for long-term investors in 2025.*Stock prices used were the afternoon prices of Dec. 13, 2024. The video was published on Dec. 15, 2024.Continue reading ...",https://www.fool.com/investing/2024/12/17/1-undervalued-growth-stock-down-71-to-buy-before/,2024-12-17 15:30:00,Motley Fool,-0.373732,0.0
2024-12-17,Best Accounting Software  ( Dec 2024 ) : QuickBooks Online Awarded Top Accounting Software for Small Business by Expert Consumers,"Boston, Dec. 17, 2024 ( GLOBE NEWSWIRE ) -- Expert Consumers has identified QuickBooks as one of the top accounting software solutions for small businesses in 2024.",https://www.benzinga.com/pressreleases/24/12/g42536545/best-accounting-software-dec-2024-quickbooks-online-awarded-top-accounting-software-for-small-busi,2024-12-17 18:00:00,Benzinga,0.431763,0.0
2024-12-18,5 Best-Performing Single-Stock ETFs of 2024,We have highlighted five single-stock ETFs that have outperformed the market in 2024.,https://www.zacks.com/stock/news/2385387/5-best-performing-single-stock-etfs-of-2024,2024-12-18 16:00:00,Zacks Commentary,0.34041,0.0
2024-12-18,Could Shopify Be Your Ticket to Becoming a Millionaire by 2035?,"Shopify ( NYSE: SHOP ) has become the go-to e-commerce solution for millions of merchants globally. That gives it tremendous power in the industry and also means it's going to benefit from growing e-commerce trends. According to Statista, in the U.S. alone, e-commerce is expected to jump from ...",https://www.fool.com/investing/2024/12/18/could-shopify-be-your-ticket-to-becoming-a-million/,2024-12-18 09:25:00,Motley Fool,0.15955,0.0
2024-12-18,Crypto.com Dropped Its SEC Lawsuit Just as CEO Met With Donald Trump,"""Honored to have a seat at the table,"" Crypto.com CEO Kris Marszalek said while sharing a picture with the U.S. president.",https://decrypt.co/297265/crypto-com-sec-lawsuit-donald-trump,2024-12-18 13:12:13,Decrypt.co,0.311698,0.0
2024-12-18,Prediction: PayPal Stock Will Beat the Market in 2025. Here's Why.,"Even though the fintech stock had a tremendous 2024, I'm highly optimistic for next year.",https://www.fool.com/investing/2024/12/18/prediction-paypal-stock-will-beat-the-market-in-20/,2024-12-18 11:21:00,Motley Fool,-0.154751,0.0
2024-12-18,What the Options Market Tells Us About PayPal Holdings - PayPal Holdings  ( NASDAQ:PYPL ) ,"Investors with a lot of money to spend have taken a bearish stance on PayPal Holdings PYPL. We noticed this today when the trades showed up on publicly available options history that we track here at Benzinga. Whether these are institutions or just wealthy individuals, we don't know.",https://www.benzinga.com/insights/options/24/12/42556843/what-the-options-market-tells-us-about-paypal-holdings,2024-12-18 15:45:32,Benzinga,0.181058,0.0
2024-12-18,MoonPay Partners With Element Wallet To Boost Core Token Access In BTCfi Ecosystem,MoonPay announced a strategic partnership with Element Wallet to enhance access to Core CORE/USD tokens within the Bitcoin BTC/USD DeFi ( BTCfi ) ecosystem.,https://www.benzinga.com/markets/cryptocurrency/24/12/42544639/moonpay-partners-with-element-wallet-to-boost-core-token-access-in-btcfi-ecosystem,2024-12-18 00:32:55,Benzinga,0.334032,0.0
2024-12-19,Can SQ's Expanding Foodservice Footprint Push the Stock Higher?,Block's expanding partner base and strong positioning in the digital payments industry are driving prospects despite stiff competition and stretched valuation.,https://www.zacks.com/stock/news/2385885/can-sqs-expanding-foodservice-footprint-push-the-stock-higher,2024-12-19 16:46:00,Zacks Commentary,0.295078,0.0
2024-12-19,Paypal  ( PYPL )  Advances While Market Declines: Some Information for Investors,"Paypal (PYPL) concluded the recent trading session at $86.78, signifying a +1.56% move from its prior day's close.",https://www.zacks.com/stock/news/2385988/paypal-pypl-advances-while-market-declines-some-information-for-investors,2024-12-19 22:45:20,Zacks Commentary,0.142319,0.0
2024-12-20,"Banking app Dave, back from the brink, is this year's biggest gainer among financials with 934% surge","Dave, which makes money by extending loans to cash-strapped Americans, is emblematic of a larger shift that's still in its early stages, analysts say.",https://www.cnbc.com/2024/12/20/dave-robinhood-biggest-financial-stock-gainers.html,2024-12-20 17:30:01,CNBC,0.206965,0.0
2024-12-20,My Top 10 Portfolio Holdings for 2025,This combination of growth and value stocks has the potential to outperform the broader market in 2025 (and beyond).,https://www.fool.com/investing/2024/12/20/my-top-10-portfolio-holdings-for-2025/,2024-12-20 09:51:00,Motley Fool,0.341973,0.0
