Date,title,description,url,publishedAt,source,sentiment,relevance
2025-02-13,Can Solana Make You a Millionaire in 2025?,"Few asset classes have created millionaires faster than crypto. Known for their explosive volatility, these digital assets have allowed retail investors to trounce benchmarks like the NASDAQ Composite and S&P 500. That said, not all cryptocurrencies are created equal.",https://www.fool.com/investing/2025/02/13/can-solana-make-you-a-millionaire-in-2025/,2025-02-13 14:21:00,Motley Fool,0.299201,0.0
2025-02-14,Prediction: 2 Stocks That'll Be Worth More Than Bank of America 10-15 Years From Now,"Bank of America is one of the largest banks in the United States and has a market capitalization of about $350 billion, as of early 2025. There are few other financial stocks that have achieved this level of valuation.",https://www.fool.com/investing/2025/02/14/prediction-2-stocks-thatll-be-worth-more-than-bank/,2025-02-14 11:07:00,Motley Fool,0.25489,0.0
2025-02-14,"Top Stock Reports for Apple, Eli Lilly & Shopify","Today's Research Daily features new research reports on 16 major stocks, including Apple Inc. (AAPL), Eli Lilly and Company (LLY) and Shopify Inc. (SHOP), as well as a micro-cap stock ImmuCell Corporation (ICCC).",https://www.zacks.com/research-daily/2415989/top-stock-reports-for-apple-eli-lilly-shopify,2025-02-14 22:54:00,Zacks Commentary,0.296738,0.0
2025-02-15,Here Are My 10 Top Stocks to Buy in 2025,"There are still some highly attractive opportunities in the stock market, and here are some of my favorites.",https://www.fool.com/investing/2025/02/15/here-are-my-10-top-stocks-to-buy-in-2025/,2025-02-15 12:21:00,Motley Fool,-0.085808,0.0
2025-02-15,Where Will PayPal Be in 1 Year?,The fintech powerhouse is making a lot of changes.,https://www.fool.com/investing/2025/02/15/where-will-writers-choice-be-in-13510-years-f9/,2025-02-15 11:15:00,Motley Fool,0.26522,0.0
2025-02-15,3 No-Brainer Growth Stocks to Buy With $100 Right Now,"Many growth stocks' prices have gotten ahead of themselves, but the market is offering a discount on the following three.",https://www.fool.com/investing/2025/02/15/3-no-brainer-growth-stocks-to-buy-with-100-right-n/,2025-02-15 08:41:00,Motley Fool,0.423715,0.0
2025-02-17,Can an Expanding Clientele Push PayPal Shares Higher in 2025?,"PYPL's cheap valuation, strong portfolio and expanding clientele make the stock attractive.",https://www.zacks.com/stock/news/2417056/can-an-expanding-clientele-push-paypal-shares-higher-in-2025,2025-02-17 16:03:00,Zacks Commentary,0.354702,0.0
2025-02-17,SHOP Rises 21% Year to Date: Buy or Hold the Stock Post Q4 Earnings?,"Shopify benefits from a booming merchant base, an expanding partner base and a strong solutions portfolio amid rising investments in core business.",https://www.zacks.com/stock/news/2417060/shop-rises-21-year-to-date-buy-or-hold-the-stock-post-q4-earnings,2025-02-17 16:09:00,Zacks Commentary,0.35264,0.0
2025-02-18,"The Zacks Analyst Blog Highlights Apple, Eli Lilly, Shopify and ImmuCell","Apple, Eli Lilly, Shopify and ImmuCell are part of the Zacks top Analyst Blog.",https://www.zacks.com/stock/news/2417427/the-zacks-analyst-blog-highlights-apple-eli-lilly-shopify-and-immucell,2025-02-18 14:48:00,Zacks Commentary,0.261649,0.0
2025-02-18,PayPal Holdings Options Trading: A Deep Dive into Market Sentiment - PayPal Holdings  ( NASDAQ:PYPL ) ,"High-rolling investors have positioned themselves bearish on PayPal Holdings PYPL, and it's important for retail traders to take note. \This activity came to our attention today through Benzinga's tracking of publicly available options data.",https://www.benzinga.com/insights/options/25/02/43784888/paypal-holdings-options-trading-a-deep-dive-into-market-sentiment,2025-02-18 15:00:57,Benzinga,0.198031,0.0
2025-02-19,Motley Fool Canada Analyst Gives Investors the Perspective From the North,Think you know how the trade wars will shake out? Don't bet on it.,https://www.fool.com/investing/2025/02/19/motley-fool-canada-analyst-gives-investors-the-per/,2025-02-19 13:56:00,Motley Fool,0.168103,0.0
2025-02-19,Big Tech's Spending Spree,"In this podcast, Motley Fool analysts Ron Gross and Jason Moser and host Dylan Lewis discuss:And Motley Fool host Ricky Mulvey chats with Motley Fool analyst Nick Sciple for the investing angle on legalized sports betting and why parlays are the penny stocks of gambling.To catch full episodes of ...",https://www.fool.com/investing/2025/02/19/big-techs-spending-spree/,2025-02-19 14:38:00,Motley Fool,0.152106,0.0
2025-02-19,Shopify President Harley Finkelstein Gives Us an Inside Look,"In this podcast, we dive into Shopify's earnings and long-term vision with President Harley Finkelstein. He joined Motley Fool host Ricky Mulvey and analyst Asit Sharma to discuss:Got a question for the show? Email us at podcasts@fool.comTo catch full episodes of all The Motley Fool's free ...",https://www.fool.com/investing/2025/02/19/shopify-president-harley-finkelstein-gives-us-an-i/,2025-02-19 18:55:00,Motley Fool,0.209696,0.0
2025-02-20,"Stablecoin Legislation Could Unleash 1,000 Tether and USDC Rivals, Expert Says","A federal framework would embolden countless companies to dive into the stablecoin market, according to Chronicle Labs founder Niklas Kunkel.",https://decrypt.co/307022/stablecoin-legislation-could-unleash-1000-new-coins,2025-02-20 18:24:21,Decrypt.co,0.123944,0.0
2025-02-20,"Palantir shares drop 13%, falling for a second day as retail traders' latest cult obsession starts to unwind",Shares dropped around 10% in Wednesday's session.,https://www.cnbc.com/2025/02/20/palantir-shares-drop-6percent-falling-for-a-second-day-as-retail-traders-latest-cult-trade-starts-to-unwind.html,2025-02-20 14:59:47,CNBC,0.131227,0.0
2025-02-20,How Is The Market Feeling About PayPal Holdings? - PayPal Holdings  ( NASDAQ:PYPL ) ,"PayPal Holdings's PYPL short percent of float has fallen 12.98% since its last report. The company recently reported that it has 24.85 million shares sold short, which is 2.48% of all regular shares that are available for trading.",https://www.benzinga.com/insights/short-sellers/25/02/43846981/how-is-the-market-feeling-about-paypal-holdings,2025-02-20 13:30:32,Benzinga,0.262256,0.0
2025-02-21,Should You Buy PayPal While It's Below $80?,"The 2020s have been quite an up-and-down period for PayPal ( NASDAQ: PYPL ) . After all, it was a star stock during the pandemic, but it slumped a bit when U.S. consumers started to emerge from their stay-at-home isolation.A good 2024 was followed by a discouraging earnings report early this ...",https://www.fool.com/investing/2025/02/21/should-you-buy-paypal-while-its-below-80/,2025-02-21 09:40:00,Motley Fool,0.119889,0.0
2025-02-21,"Is Most-Watched Stock PayPal Holdings, Inc.  ( PYPL )  Worth Betting on Now?","Paypal (PYPL) has received quite a bit of attention from Zacks.com users lately. Therefore, it is wise to be aware of the facts that can impact the stock's prospects.",https://www.zacks.com/stock/news/2419409/is-most-watched-stock-paypal-holdings-inc-pypl-worth-betting-on-now,2025-02-21 14:00:15,Zacks Commentary,0.202141,0.0
2025-02-23,Author of Upcoming Elon Musk Biography Questions His 'Intellectual Achievements' - Tesla  ( NASDAQ:TSLA ) ,"Seth Abramson challenges the narrative of Elon Musk's intellectual prowess, sparking online debates. The biographer claims Musk's success is largely due to financial investments, not intellectual achievements.",https://www.benzinga.com/general/social-media/25/02/43902702/author-of-upcoming-elon-musk-biography-questions-his-intellectual-achievements,2025-02-23 13:30:26,Benzinga,0.22766,0.0
2025-02-24,Should You Follow Cathie Wood in Buying the Nu Holdings Stock Dip?,The Brazilian fintech star is turning heads after a post-earnings sell-off.,https://www.fool.com/investing/2025/02/24/should-you-follow-cathie-wood-in-buying-the-nu-hol/,2025-02-24 13:30:00,Motley Fool,0.152307,0.0
2025-03-08,"Elon Musk's Ex-Wife Spills The Truth About What It Really Takes To Be A Billionaire: 'There Is No Roadmap, No Blueprint For This' - Tesla  ( NASDAQ:TSLA ) ","Justine Musk reveals the raw truth behind achieving billionaire status, beyond hard work and determination. Extreme challenges and high risks are part of the journey to a billion-dollar fortune, as per Elon Musk's ex-wife. Our government trade tracker caught Pelosi's 169% AI winner.",https://www.benzinga.com/general/social-media/25/03/44209885/elon-musks-ex-wife-spills-the-truth-about-what-it-really-takes-to-be-a-billionaire-there-is-,2025-03-08 19:40:35,Benzinga,0.224788,0.0
2025-03-09,PayPal CEO Alex Chriss Just Gave Investors Amazing News,"The market hasn't been treating PayPal Holdings ( NASDAQ: PYPL ) shareholders very well over the past few years. It's not unwarranted, of course. PayPal has been struggling with a number of issues, from growing competition to slowing growth and declining profits.",https://www.fool.com/investing/2025/03/09/paypal-ceo-alex-chriss-just-gave-investors-amazing/,2025-03-09 13:45:00,Motley Fool,0.225207,0.0
2025-03-10,Nasdaq Stock Market Correction: 2 Ultra-Cheap Stocks to Buy Right Now,"The Nasdaq Composite ( NASDAQINDEX: ^IXIC ) is now 13% below its recent high, placing the tech-heavy index officially into correction territory. And while there are certainly good reasons why the market has been under pressure recently, such as recession fears and the potential effects of ...",https://www.fool.com/investing/2025/03/10/nasdaq-stock-market-correction-2-ultra-cheap-stock/,2025-03-10 19:23:00,Motley Fool,0.253462,0.0
2025-03-10,Synchrony Declines 16.1% in a Month: Is the Stock a Buy on the Dip?,"SYF's net charge-off rate is expected to decline in 2025, particularly in the second half of the year.",https://www.zacks.com/stock/news/2427876/synchrony-declines-161-in-a-month-is-the-stock-a-buy-on-the-dip,2025-03-10 15:46:00,Zacks Commentary,0.332805,0.0
2025-03-10,"Zero Hash integrates PayPal USD  ( PYUSD ) , expanding its stablecoin offering","CHICAGO, March 10, 2025 ( GLOBE NEWSWIRE ) -- Zero Hash, the leading crypto and stablecoin infrastructure platform, today announced the integration of PayPal USD ( PYUSD ) , a regulated stablecoin issued by Paxos Trust Company on behalf of PayPal.",https://www.benzinga.com/pressreleases/25/03/g44219303/zero-hash-integrates-paypal-usd-pyusd-expanding-its-stablecoin-offering,2025-03-10 13:36:31,Benzinga,0.228274,0.0
2025-03-10,Here's why banks don't want the CFPB to disappear,The Consumer Financial Protection Bureau and its employees are in limbo after acting Director Russell Vought took over last month.,https://www.cnbc.com/2025/03/10/why-banks-dont-want-the-cfpb-to-disappear.html,2025-03-10 12:37:22,CNBC,0.024162,0.0
2025-03-10,Banks and fintechs join 'stablecoin gold rush',Bank of America and Stripe target market for payments in ...,https://www.ft.com/content/d033e015-f726-4d5f-ab38-2949171f2cdc,2025-03-10 05:00:32,Financial Times,0.13895,0.0
2025-03-11,"Palantir Cofounder Peter Thiel Might Write A Book About Ancient Prophecies, The Antichrist, And Armageddon- He Thinks We're Ignoring The Real Threat","Tech billionaire and venture capitalist Peter Thiel is considering writing a book about ancient prophecies, the Antichrist, and Armageddon-and he believes we're ignoring what may be the most dangerous threat of all: the rise of global authoritarianism disguised as peace.",https://www.benzinga.com/tech/25/03/44238979/palantir-cofounder-peter-thiel-might-write-a-book-about-ancient-prophecies-the-antichrist-and-armageddon-he-,2025-03-11 00:56:23,Benzinga,0.108651,0.0
2025-03-11,5 Great Stocks You Can Buy on Sale Right Now,"With the market pulling back from its highs, there are more opportunities for long-term investors.",https://www.fool.com/investing/2025/03/11/5-great-stocks-you-can-buy-on-sale-right-now/,2025-03-11 10:11:00,Motley Fool,-0.059971,0.0
2025-03-11,Nasdaq Correction: 2 Pullback Stocks to Buy and Hold for a Decade,"Well, it has happened: After around two years of semismooth sailing, the Nasdaq has entered into correction territory. The Nasdaq Composite, one of the stock market's primary indexes, was down over 9% year to date as of market close March 10, and down roughly 13% since hitting a high on Dec. ...",https://www.fool.com/investing/2025/03/11/nasdaq-correction-2-pullback-stocks-to-buy-and-hol/,2025-03-11 14:26:00,Motley Fool,0.204767,0.0
2025-03-11,The Nasdaq Just Hit Correction Territory. Here's 1 ETF I'm Loading Up on Regardless.,"The Nasdaq party has been going on for a couple of years, but it seems the club owner has turned on the lights, with the index heading into correction territory.A stock market correction happens when a major index falls between 10% and 20% of recent highs, and that's exactly what has happened ...",https://www.fool.com/investing/2025/03/11/the-nasdaq-just-hit-correction-territory-heres-1-e/,2025-03-11 14:45:00,Motley Fool,0.042903,0.0
2025-03-11,XRP's RLUSD Stablecoin Has Only 0.7% Market Share: What Is Going On?,"Ripple's RLUSD, launched for enterprises, holds less than 0.7% of the market despite stabilizing at $1 peg. Offshore giants like Tether's USDT dominate, overshadowing U.S.-backed stablecoins despite a favorable regulatory shift. Find out which stock just claimed the top spot in the new Benzinga ...",https://www.benzinga.com/markets/cryptocurrency/25/03/44252537/xrps-rlusd-stablecoin-has-only-0-7-market-share-what-is-going-on,2025-03-11 15:18:22,Benzinga,0.137272,0.0
2025-03-11,Fidelity National Enhances Treasury Management With Treasury GPT,"FIS launches Treasury GPT, an AI-powered tool to boost efficiency in treasury management.",https://www.zacks.com/stock/news/2428499/fidelity-national-enhances-treasury-management-with-treasury-gpt,2025-03-11 16:13:00,Zacks Commentary,0.406782,0.0
2025-03-11,"Bitcoin Reserve Upgrades Crypto But Paypal, Ripple Stablecoins Lag Behind","Despite regulatory support, PayPal's PYUSD and Ripple's RLUSD struggle to gain traction, trailing dominant offshore stablecoins like USDT. Tether and offshore stablecoins dominate, showing market forces, not regulation, drive stablecoin adoption in global crypto markets.",https://www.benzinga.com/markets/cryptocurrency/25/03/44258476/bitcoin-reserve-upgrades-crypto-but-paypal-ripple-stablecoins-lag-behind,2025-03-11 18:07:03,Benzinga,0.136335,0.0
2025-03-11,Paypal  ( PYPL )  Stock Moves -0.25%: What You Should Know,"In the most recent trading session, Paypal (PYPL) closed at $67.99, indicating a -0.25% shift from the previous trading day.",https://www.zacks.com/stock/news/2428656/paypal-pypl-stock-moves--025-what-you-should-know,2025-03-11 21:45:15,Zacks Commentary,0.126541,0.0
2025-03-12,Accenture to Acquire Soben to Boost Capital Project Capabilities,The acquisition will likely enhance ACN's ability to help clients overcome challenges in planning and executing large-scale infrastructure and modernization projects.,https://www.zacks.com/stock/news/2429261/accenture-to-acquire-soben-to-boost-capital-project-capabilities,2025-03-12 17:48:00,Zacks Commentary,0.226229,0.0
2025-03-12,Fiserv Gains From Growth in Clover Despite Increased Competition,"The FI stock is benefiting from its innovative business model, robust liquidity position and shareholder-friendly policy.",https://www.zacks.com/stock/news/2429236/fiserv-gains-from-growth-in-clover-despite-increased-competition,2025-03-12 15:32:00,Zacks Commentary,0.276238,0.0
2025-03-12,Visa Strengthens Fraud Prevention With New Scam Disruption Initiative,"V's Scam Disruption initiative leverages AI and expertise to prevent fraud, protect consumers and enhance its leadership in secure digital payments.",https://www.zacks.com/stock/news/2429244/visa-strengthens-fraud-prevention-with-new-scam-disruption-initiative,2025-03-12 15:44:00,Zacks Commentary,0.155438,0.0
2025-03-12,Thumzup Media Corporation Authorizes Share Repurchase Program of Up to $1 Million - Thumzup Media  ( NASDAQ:TZUP ) ,"Company Closed $8.2 Million at $5 per Share in a Common-Stock Only Offering Simultaneous with Its Nasdaq Listing in October 2024 Insiders Purchased Approximately $62,000 in Common Stock Between $3.20 and $4.73 During the Last Trading Window Platform Recently Surpassed 700 Advertisers - CAGR of ...",https://www.benzinga.com/pressreleases/25/03/n44277148/thumzup-media-corporation-authorizes-share-repurchase-program-of-up-to-1-million,2025-03-12 14:00:00,Benzinga,0.235927,0.0
2025-03-13,Buy 5 AI-Powered Non-Tech Stocks to Tap Massive Short-Term Potential,"Here we present five AI-powered non-tech stocks have solid growth potential for 2025. These are: PYPL, V, UPST, NFLX, JCI.",https://www.zacks.com/stock/news/2429688/buy-5-ai-powered-non-tech-stocks-to-tap-massive-short-term-potential,2025-03-13 14:03:00,Zacks Commentary,0.274022,0.0
2025-03-13,Why FinTechs Are Moving to Super Apps?,"If you've been following the FinTech space, you've probably noticed a massive shift. Companies that once relied on sleek websites and standalone apps are now moving towards something bigger-Super Apps. Super apps aren't just trending. they're completely changing the way users interact with ...",https://www.benzinga.com/fintech/25/03/44308042/is-it-the-end-of-websites-why-fintech-companies-are-moving-to-super-apps,2025-03-13 15:58:27,Benzinga,0.335267,0.0
2025-03-13,MoonPay acquires API stablecoin infrastructure platform Iron,"Cryptocurrency payments company MoonPay is expanding its presence in the enterprise stablecoin market with the acquisition of Iron, an API-focused stablecoin infrastructure developer, for an undisclosed amount. According to a March 13 announcement, the acquisition will give MoonPay's enterprise ...",https://cointelegraph.com/news/moonpay-acquires-api-stablecoin-infrastructure-platform-iron,2025-03-13 16:32:09,Cointelegraph,0.335602,0.0
2025-03-13,Better Fintech Stock: PayPal vs. Robinhood,Which of these fintech leaders is a better buy right now?,https://www.fool.com/investing/2025/03/13/better-fintech-stock-paypal-vs-robinhood/,2025-03-13 12:10:00,Motley Fool,0.192226,0.0
2025-03-14,"The Banks Secretly Don't Want The CFPB To Be 'Deleted'?-CFPB Lawyer Warns That Apple, PayPal, Cash App, And X Will 'Run Wild' - PayPal Holdings  ( NASDAQ:PYPL ) ","For years, big banks and the financial industry have fought against the Consumer Financial Protection Bureau, arguing that its regulations were too aggressive.",https://www.benzinga.com/25/03/44332648/the-banks-secretly-dont-want-the-cfpb-to-be-deleted-cfpb-lawyer-warns-that-apple-paypal-cash-app-and-x-will-run-w,2025-03-14 15:15:42,Benzinga,0.048575,0.0
2025-03-14,PYPL or MA: Which Is the Better Value Stock Right Now?,PYPL vs. MA: Which Stock Is the Better Value Option?,https://www.zacks.com/stock/news/2430355/pypl-or-ma-which-is-the-better-value-stock-right-now,2025-03-14 15:40:08,Zacks Commentary,0.455286,0.0
2025-03-17,Paypal  ( PYPL )  Beats Stock Market Upswing: What Investors Need to Know,"Paypal (PYPL) concluded the recent trading session at $69.65, signifying a +1.02% move from its prior day's close.",https://www.zacks.com/stock/news/2431080/paypal-pypl-beats-stock-market-upswing-what-investors-need-to-know,2025-03-17 21:45:16,Zacks Commentary,0.15894,0.0
2025-03-17,"Here is What to Know Beyond Why PayPal Holdings, Inc.  ( PYPL )  is a Trending Stock","Paypal (PYPL) has been one of the stocks most watched by Zacks.com users lately. So, it is worth exploring what lies ahead for the stock.",https://www.zacks.com/stock/news/2430666/here-is-what-to-know-beyond-why-paypal-holdings-inc-pypl-is-a-trending-stock,2025-03-17 13:00:11,Zacks Commentary,0.23976,0.0
2025-03-17,"With Doubts Over Musk's Tesla Commitment Growing, His Own Words Resurface-He Once Said He Never Wanted To Be CEO As It 'Hurts' His Heart - PayPal Holdings  ( NASDAQ:PYPL ) , Tesla  ( NASDAQ:TSLA ) ","As Tesla TSLA investors grow uneasy about his divided focus, Elon Musk's past statements are resurfacing-including his claim that he never wanted to be CEO because it ""hurts"" his heart. Tesla's stock has plummeted 52% from its mid-December high, with shares declining every week since Musk went to ...",https://www.benzinga.com/news/25/03/44356670/with-doubts-over-musks-tesla-commitment-growing-his-own-words-resurface-he-once-said-he-never-wanted-to-be-c,2025-03-17 13:45:19,Benzinga,0.014543,0.0
2025-03-18,It's Been 44 Months Since PayPal Stock Set Its All-Time High. Here's 1 Reason to Buy Today.,"PayPal ( NASDAQ: PYPL ) was one of the biggest winners of the pandemic years, as hundreds of millions of people were forced to shop online for goods and services, and to send money to friends and family without any physical contact.",https://www.fool.com/investing/2025/03/18/its-been-44-months-since-paypal-stock-set-its-all/,2025-03-18 11:21:00,Motley Fool,0.344279,0.0
2025-03-19,Could Buying Block Stock Today Set You Up for Life?,"When you think about stocks that could set you up for life, they usually come in one of two genres: young disruptors that have incredible opportunity, or winners that are already succeeding. Turnaround stories are another category that offers serious potential, but they come with much higher ...",https://www.fool.com/investing/2025/03/19/could-buying-hot-ticker-stock-today-set-you-up-for/,2025-03-19 08:30:00,Motley Fool,0.084957,0.0
2025-03-19,Prime Biome Reviewed: A Prime Biome Expert's Guide to Avoiding Fakes and Ensuring Authenticity,"ST. PETERSBURG, Fla., March 19, 2025 ( GLOBE NEWSWIRE ) -- Prime Biome is a leading skin and gut microbiome rejuvenation supplement that has taken the wellness world by storm. This innovative formula-offered as delicious gummies-targets the gut-skin axis to promote a vibrant complexion and ...",https://www.benzinga.com/pressreleases/25/03/g44397473/prime-biome-reviewed-a-prime-biome-experts-guide-to-avoiding-fakes-and-ensuring-authenticity,2025-03-19 13:23:25,Benzinga,0.15277,0.0
2025-03-19,"Elon Musk's First Ex-Wife Says She 'Sucked' At Being His Trophy Wife And Recalls Him Saying: 'If You Were My Employee, I Would Fire You'","Before Elon Musk became a household name-launching rockets, revolutionizing cars, and single-handedly turning tech CEOs into celebrities-he was someone else entirely: a determined college kid in Canada awkwardly holding melting ice cream cones, relentlessly courting his future first wife, ...",https://www.benzinga.com/news/25/03/44402199/elon-musks-first-ex-wife-says-she-sucked-at-being-his-trophy-wife-and-recalls-him-saying-if-you-were-my-empl,2025-03-19 17:07:24,Benzinga,0.014814,0.0
2025-03-21,Thumzup Media Corporation Announces Insider Open Market Stock Purchases and Ongoing Share Repurchase Activity - Thumzup Media  ( NASDAQ:TZUP ) ,"Management and Directors demonstrate long-term confidence with recent insider open market stock purchases since up-listing to Nasdaq of more than $120,000 and have invested more than $742,000 since inception",https://www.benzinga.com/pressreleases/25/03/n44440563/thumzup-media-corporation-announces-insider-open-market-stock-purchases-and-ongoing-share-repurcha,2025-03-21 16:56:00,Benzinga,0.2486,0.0
2025-03-21,Should Growth Stock Investors Buy PayPal Stock?,"PayPal ( NASDAQ: PYPL ) boasts over 400 million active customers, which is a key driver of its competitive advantage.*Stock prices used were the afternoon prices of March 17, 2025. The video was published on March 19, 2025.Continue reading ...",https://www.fool.com/investing/2025/03/21/should-growth-stock-investors-buy-paypal-stock/,2025-03-21 10:30:00,Motley Fool,-0.362268,0.0
2025-03-21,Playcasino.co.nz Releases Comprehensive Guide to Online Casino Payment Methods for NZ Players,"AUCKLAND, New Zealand, March 21, 2025 /PRNewswire/ -- Playcasino.co.nz has published a new comprehensive guide to payment methods for New Zealand online casino players.",https://www.benzinga.com/pressreleases/25/03/n44431343/playcasino-co-nz-releases-comprehensive-guide-to-online-casino-payment-methods-for-nz-players,2025-03-21 08:23:00,Benzinga,0.380666,0.0
2025-03-22,The S&P 500 Entered a Correction Last Week. 3 Stocks Down 20% or More to Buy on the Dip.,"A stock market correction refers to a 10% to 20% pullback from a peak. The S&P 500 ( SNPINDEX: ^GSPC ) -- an index that includes roughly 500 of the country's biggest, profitable publicly traded businesses -- hit correction territory on March 13.",https://www.fool.com/investing/2025/03/22/the-sp-500-entered-a-correction-last-week-3-stocks/,2025-03-22 08:15:00,Motley Fool,0.291296,0.0
2025-03-22,Kerassentials Reviews: Does Kerassentials Really Work for Toenail Fungus? Expert Guide & Warnings,"TALLMADGE, Ohio, March 22, 2025 ( GLOBE NEWSWIRE ) -- Kerassentials is a popular new toenail fungus treatment oil - but warning: Amazon, Walmart, and other third-party platforms carry Kerassentials listings that the official company has marked as fake.",https://www.benzinga.com/pressreleases/25/03/g44448753/kerassentials-reviews-does-kerassentials-really-work-for-toenail-fungus-expert-guide-warnings,2025-03-22 15:02:23,Benzinga,0.259278,0.0
2025-03-23,"With the SEC Reportedly Dropping Its Case Against Ripple, Is XRP Finally a Buy for Less Than $3?",Ripple's CEO just gave investors some long-awaited great news.,https://www.fool.com/investing/2025/03/23/should-you-buy-xrp-before-april-16/,2025-03-23 09:00:00,Motley Fool,0.136995,0.0
2025-03-23,1 Magnificent Stock You'll Regret Not Buying in the Nasdaq Correction,"Although market downturns can be anxiety-inducing, they are perfectly normal and, in fact, always create opportunities for astute investors to scoop up shares of great companies from the discount bin. The recent dip that especially affected the tech-heavy Nasdaq Composite is no different.",https://www.fool.com/investing/2025/03/23/1-magnificent-stock-youll-regret-not-buying-in-the/,2025-03-23 11:00:00,Motley Fool,0.322102,0.0
