Date,title,description,url,publishedAt,source,sentiment,relevance
2025-07-03,MoneyHero Group Launches First Annual SingSaver Best-Of Awards to Recognise Excellence in Personal Financial Products,"New awards programme highlights exceptional credit cards, digital banks, investments and insurances to help Singaporeans make smarter financial choices New awards programme highlights exceptional credit cards, digital banks, investments and insurances to help Singaporeans make smarter financial ...",https://www.globenewswire.com/news-release/2025/07/03/3109636/0/en/MoneyHero-Group-Launches-First-Annual-SingSaver-Best-Of-Awards-to-Recognise-Excellence-in-Personal-Financial-Products.html,2025-07-03 03:00:00,GlobeNewswire,0.43441,0.0
2025-07-04,Prediction: 3 Magnificent Stocks That'll Be Worth More Than Palantir by 2028,The parabolic ascent of artificial intelligence (AI) superstar Palantir Technologies may be short-lived.,https://www.fool.com/investing/2025/07/04/prediction-3-stocks-worth-more-palantir-by-2028/,2025-07-04 07:51:00,Motley Fool,0.160879,0.0
2025-07-04,3 Key Headwinds Facing USDC,How safe are your stablecoins? Take a closer look at USDC's future and the risks that could impact its backers at Circle and Coinbase.,https://www.fool.com/investing/2025/07/04/3-key-headwinds-facing-usdc/,2025-07-04 11:07:00,Motley Fool,0.148166,0.0
2025-07-04,Looking Into PayPal Holdings's Recent Short Interest - PayPal Holdings  ( NASDAQ:PYPL ) ,"PayPal Holdings's PYPL short percent of float has risen 7.17% since its last report. The company recently reported that it has 27.56 million shares sold short, which is 2.84% of all regular shares that are available for trading.",https://www.benzinga.com/insights/short-sellers/25/07/46261153/looking-into-paypal-holdingss-recent-short-interest,2025-07-04 15:00:38,Benzinga,0.271645,0.0
2025-07-05,Where Will Tesla Stock Be in 3 Years?,"With shares down 21% year to date, Tesla ( NASDAQ: TSLA ) is reeling from a combination of weakening electric vehicle ( EV ) demand, political uncertainty, and a CEO who seems to have misplaced priorities. The next three years will be a make-or-break period for the company as it attempts to roll ...",https://www.fool.com/investing/2025/07/05/where-will-tesla-stock-be-in-3-years/,2025-07-05 22:30:00,Motley Fool,0.178427,0.0
2025-07-06,"VC Roundup: DeFi, AI, hybrid exchanges showcase resilient month for crypto","Rails, Yupp, Beam, Frachtis, Interface Labs, Gradient Network, Story, Blueprint Finance and Units Network headline the latest VC Roundup.",https://cointelegraph.com/news/vc-roundup-june-crypto-funding-rails-ai-defi,2025-07-06 17:50:47,Cointelegraph,0.206638,0.0
2025-07-07,Affirm Stock Skyrockets 146% in a Year: Is it Too Late to Buy?,"AFRM stock has soared 146% in a year, fueled by repeat users, global expansion and rising transactions. But is the run sustainable?",https://www.zacks.com/stock/news/2565536/affirm-stock-skyrockets-146-in-a-year-is-it-too-late-to-buy,2025-07-07 12:52:00,Zacks Commentary,0.301406,0.0
2025-07-07,Why This 1 Value Stock Could Be a Great Addition to Your Portfolio,"Whether you're a value, growth, or momentum investor, finding strong stocks becomes easier with the Zacks Style Scores, a top feature of the Zacks Premium research service.",https://www.zacks.com/stock/news/2565728/why-this-1-value-stock-could-be-a-great-addition-to-your-portfolio,2025-07-07 13:40:03,Zacks Commentary,0.405385,0.0
2025-07-07,Visa's Partnerships With BNPL Players: Smart Hedge or Future Risk?,V teams up with BNPL firms like Klarna and Afterpay to stay central in payments as credit habits shift.,https://www.zacks.com/stock/news/2565966/visas-partnerships-with-bnpl-players-smart-hedge-or-future-risk,2025-07-07 14:51:00,Zacks Commentary,0.252891,0.0
2025-07-07,Shopify vs. Adobe: Which E-Commerce Stock Is the Better Buy Now?,"ADBE edges ahead of SHOP as the stronger e-commerce bet, thanks to cloud-native upgrades and rising earnings momentum.",https://www.zacks.com/stock/news/2566090/shopify-vs-adobe-which-e-commerce-stock-is-the-better-buy-now,2025-07-07 15:55:00,Zacks Commentary,0.386042,0.0
2025-07-07,How to Find Strong Business Services Stocks Slated for Positive Earnings Surprises,Finding stocks expected to beat quarterly earnings estimates becomes an easier task with our Zacks Earnings ESP.,https://www.zacks.com/stock/news/2565546/how-to-find-strong-business-services-stocks-slated-for-positive-earnings-surprises,2025-07-07 12:50:08,Zacks Commentary,0.39773,0.0
2025-07-08,Bull of the Day: Paysafe Limited  ( PSFE ) ,Paysafe (PSFE) stock still has the undervalued prospects that investors are searching for with the broader market recouping more than 10% gains in the last three months.,https://www.zacks.com/commentary/2566370/bull-of-the-day-paysafe-limited-psfe,2025-07-08 08:00:00,Zacks Commentary,0.414561,0.0
2025-07-08,Paysafe and Champion Homes have been highlighted as Zacks Bull and Bear of the Day,"PSFE earns Bull of the Day with deep value and rising earnings, while SKY's short surge and weak outlook land it as Bear of the Day.",https://www.zacks.com/stock/news/2567177/paysafe-and-champion-homes-have-been-highlighted-as-zacks-bull-and-bear-of-the-day,2025-07-08 13:22:00,Zacks Commentary,0.349451,0.0
2025-07-08,Paypal  ( PYPL )  is a Top-Ranked Growth Stock: Should You Buy?,"Whether you're a value, growth, or momentum investor, finding strong stocks becomes easier with the Zacks Style Scores, a top feature of the Zacks Premium research service.",https://www.zacks.com/stock/news/2567293/paypal-pypl-is-a-top-ranked-growth-stock-should-you-buy,2025-07-08 13:45:03,Zacks Commentary,0.391765,0.0
2025-07-08,Mastercard's Fintech Ties in Emerging Markets: Bold Move or Risky Bet?,"MA deepens fintech ties across emerging markets, chasing digital growth while navigating complex regional risks.",https://www.zacks.com/stock/news/2567704/mastercards-fintech-ties-in-emerging-markets-bold-move-or-risky-bet,2025-07-08 15:15:00,Zacks Commentary,0.220993,0.0
2025-07-08,Paypal  ( PYPL )  Declines More Than Market: Some Information for Investors,"The latest trading day saw Paypal (PYPL) settling at $75.03, representing a -1.51% change from its previous close.",https://www.zacks.com/stock/news/2567928/paypal-pypl-declines-more-than-market-some-information-for-investors,2025-07-08 21:45:06,Zacks Commentary,0.209051,0.0
2025-07-09,Circle and OKX launch zero-fee USDC conversions to US dollar,OKX is rolling out zero-fee conversions between Circle's USDC stablecoin and the US dollar as part of a new partnership with Circle.,https://cointelegraph.com/news/circle-okx-zero-fee-usdc-conversion-us-dollar,2025-07-09 08:30:00,Cointelegraph,0.230374,0.0
2025-07-09,3 Crypto-Focused Stocks to Buy as Bitcoin Heads Toward New High,"With Bitcoin holding near $109K and optimism rising, V, CME, and BLK emerge as top crypto-exposed stocks to watch now.",https://www.zacks.com/stock/news/2568919/3-crypto-focused-stocks-to-buy-as-bitcoin-heads-toward-new-high,2025-07-09 12:23:00,Zacks Commentary,0.223399,0.0
2025-07-11,Affirm's GMV Poised for Growth on an Expanding Merchant Base,AFRM's growing merchant base and global tie-ups are powering broader reach and stronger transaction growth.,https://www.zacks.com/stock/news/2574276/affirms-gmv-poised-for-growth-on-an-expanding-merchant-base,2025-07-11 16:31:00,Zacks Commentary,0.197262,0.0
2025-07-11,Can Mastercard Stay Ahead in the Race Toward a Digital Wallet Future?,"MA is accelerating its shift toward a cardless future with tokenization, digital wallets and tech partnerships.",https://www.zacks.com/stock/news/2573837/can-mastercard-stay-ahead-in-the-race-toward-a-digital-wallet-future,2025-07-11 14:49:00,Zacks Commentary,0.181102,0.0
2025-07-11,"Fintech Stocks Slip As JPMorgan Plans Data Access Fees, But Affirm Defies The Trend - PayPal Holdings  ( NASDAQ:PYPL ) ","JPMorgan's plan to charge fintechs for customer data access is pressuring payments stocks and reshaping industry economics. Affirm shares rose despite the sector-wide selloff, signaling relative insulation from immediate impacts of the new fees.",https://www.benzinga.com/trading-ideas/movers/25/07/46377201/fintech-stocks-slip-as-jpmorgan-plans-data-access-fees-but-affirm-defies-the-trend,2025-07-11 19:52:17,Benzinga,0.071303,0.0
2025-07-11,"Visa And Mastercard Remain Top Picks, But One May Outpace Growth - Mastercard  ( NYSE:MA ) , Visa  ( NYSE:V ) ","Visa and Mastercard ride digital payment trends like BNPL, wallets, and real-time payments, but face growing crypto and fee pressure. Analysts flag macro risks, travel slowdown, and stablecoin disruption as headwinds, though both card giants post strong earnings growth.",https://www.benzinga.com/markets/large-cap/25/07/46365557/visa-vs-mastercard,2025-07-11 13:03:49,Benzinga,0.254327,0.0
2024-01-29,Deliveroo partners with Rokt to expand retail media with non-endemic offers USA - English - PR Newswire,Deliveroo partners with Rokt to expand retail media with non-endemic offers USA - English PR ...,https://www.prnewswire.com/news-releases/deliveroo-partners-with-rokt-to-expand-retail-media-with-non-endemic-offers-302046487.html,2024-01-29 07:00:00,PR Newswire,0.266043,0.0
2024-01-29,PayPal's Phoenix Moment? What's Fueling The Stock Surge Ahead Of Q4 Results - PayPal Holdings  ( NASDAQ:PYPL ) ,"PayPal Holdings, Inc. PYPL shares, consolidating under $100 since April 2022, gained volume momentum in mid-January, sparking discussions on social media platforms and chatrooms, fueling speculation about its emergence as a new meme stock.",https://www.benzinga.com/analyst-ratings/analyst-color/24/01/36819473/paypals-phoenix-moment-whats-fueling-the-stock-surge-ahead-of-q4-results,2024-01-29 07:55:07,Benzinga,0.110096,0.0
2024-01-29,Tax season has officially started: Here's everything you need to know before filing,"Tax season officially kicks off on Monday, when the IRS will start officially accepting and processing 2023 tax returns. Don't fret: Here is everything that taxpayers need to know about this year's filing season. Most taxpayers will have until Monday, April 15 to submit their returns or request ...",https://www.foxbusiness.com/personal-finance/tax-season-has-officially-started-heres-everything-you-need-to-know-before-filing,2024-01-29 12:00:00,Fox Business News,0.116897,0.0
2024-01-29,Mesh Announces Investment from PayPal Ventures,"Investment was made using PayPal USD, PayPal's U.S. dollar denominated stablecoin SAN FRANCISCO, Jan. 29, 2024 /PRNewswire/ -- Mesh, the modern embedded finance solution that makes digital asset transfers and account aggregation seamless, today announced an investment from PayPal Ventures.",https://www.prnewswire.com/news-releases/mesh-announces-investment-from-paypal-ventures-302045961.html,2024-01-29 14:00:00,PR Newswire,0.329665,0.0
2024-01-29,Manhattan DA Urges Payment Apps To Improve Security Features,"Following a growing number of incidents of fraud and theft in New York City involving payment apps Venmo, Zelle and Cash App, Manhattan District Attorney ( DA ) Alvin Bragg is calling on executives at these apps to increase customer security.",https://www.kiplinger.com/personal-finance/online-banking/manhattan-da-urges-payment-apps--to-improve-security,2024-01-29 14:00:34,Kiplinger,0.116627,0.0
2024-01-29,Looking At PayPal Holdings's Recent Unusual Options Activity - PayPal Holdings  ( NASDAQ:PYPL ) ,"Deep-pocketed investors have adopted a bearish approach towards PayPal Holdings PYPL, and it's something market players shouldn't ignore. Our tracking of public options records at Benzinga unveiled this significant move today.",https://www.benzinga.com/insights/options/24/01/36831181/looking-at-paypal-holdingss-recent-unusual-options-activity,2024-01-29 19:00:55,Benzinga,0.203553,0.0
2024-01-29,Best Growth Stock: PayPal Stock vs. Block Stock,"These financial services companies have solid prospects over the next several years, but only one can be the best growth stock to buy today.",https://www.fool.com/investing/2024/01/29/best-growth-stock-paypal-stock-vs-block-stock/,2024-01-29 21:32:22,Motley Fool,0.274803,0.0
2024-02-20,Chase Sapphire Preferred Review 2024,"The Chase Sapphire Preferred® Card is one of the best credit cards of all time for earning and redeeming rewards toward flights, hotel stays, cruises, rental cars, and other travel adventures.",https://www.businessinsider.com/personal-finance/chase-sapphire-preferred-card-review,2024-02-20 23:47:00,Business Insider,0.362741,0.0
2024-02-21,"Tazapay Strengthens Board with Legal and Compliance Veteran Andrew Ho, Highlighting Commitment to World-Class Compliance Standards in Cross-Border Payments","Tazapay Strengthens Board with Legal and Compliance Veteran Andrew Ho, Highlighting Commitment to World-Class ... PR ...",https://www.prnewswire.com/apac/news-releases/tazapay-strengthens-board-with-legal-and-compliance-veteran-andrew-ho-highlighting-commitment-to-world-class-compliance-standards-in-cross-border-payments-302067224.html,2024-02-21 22:00:00,PR Newswire,0.396128,0.0
2024-02-21,"Block Inc Q4 Earnings Preview: Eyes On Rule Of 40, Growth, Profitability And More - Block  ( NYSE:SQ ) ","Fintech Block Inc SQ is set to report fourth quarter financial results after market close Thursday. Here's an overview of analyst predictions, their insights before the quarterly report, and crucial points for investors to watch.",https://www.benzinga.com/analyst-ratings/analyst-color/24/02/37243096/block-inc-q4-earnings-preview-eyes-on-rule-of-40-growth-profitability-and-more,2024-02-21 18:48:16,Benzinga,0.155444,0.0
2024-02-21,Looking At PayPal Holdings's Recent Unusual Options Activity - PayPal Holdings  ( NASDAQ:PYPL ) ,"Investors with a lot of money to spend have taken a bearish stance on PayPal Holdings PYPL. We noticed this today when the trades showed up on publicly available options history that we track here at Benzinga. Whether these are institutions or just wealthy individuals, we don't know.",https://www.benzinga.com/insights/options/24/02/37241338/looking-at-paypal-holdingss-recent-unusual-options-activity,2024-02-21 17:16:24,Benzinga,0.203284,0.0
2024-02-21,Here's why Capital One is buying Discover in the biggest proposed merger of 2024,Capital One is betting that owning a global payments network protects it against a rising tide of fintech and regulatory threats.,https://www.cnbc.com/2024/02/21/why-capital-one-is-buying-discover-in-the-biggest-merger-yet-of-2024.html,2024-02-21 15:42:24,CNBC,0.195304,0.0
2024-02-21,PayPal's Investors Can't Turn a Blind Eye to This Startling Chart,The digital payment giant's transaction take rates are still declining.,https://www.fool.com/investing/2024/02/21/paypal-investors-cant-turn-blind-eye-this-chart/,2024-02-21 12:50:00,Motley Fool,-0.014633,0.0
2024-02-21,Breakout Stocks & Technical Analysis,Breakout Stocks And Technical Analysis Investor's Business Daily ...,https://www.investors.com/research/breakout-stocks-technical-analysis/breakout-stocks-technical-analysis/,2024-02-21 18:40:00,Investors Business Daily,0.268495,0.0
2024-02-21,Where Will PayPal Be in 3 Years?,This beaten-down stock could surprise investors.,https://www.fool.com/investing/2024/02/21/where-will-paypal-be-in-3-years/,2024-02-21 11:30:00,Motley Fool,0.341106,0.0
2024-02-21,"Got $5,000? These 3 Stocks Are Dirt Cheap Buys With Plenty of Upside",Shares of these companies are trading at sizable earnings discounts.,https://www.fool.com/investing/2024/02/21/got-5000-these-3-stocks-are-dirt-cheap-buys-with-p/,2024-02-21 11:02:00,Motley Fool,0.164509,0.0
2024-02-21,Where Will Mastercard Be in 10 Years?,Investors remain very optimistic about this business and its stock.,https://www.fool.com/investing/2024/02/21/where-will-mastercard-stock-be-in-10-years/,2024-02-21 10:20:00,Motley Fool,0.360624,0.0
2024-02-21,2 No-Brainer Stocks I Just Bought More of in February,There's only one of these stocks I'd buy more of today.,https://www.fool.com/investing/2024/02/21/2-no-brainer-stocks-i-just-bought-more-of-in-febua/,2024-02-21 12:15:00,Motley Fool,0.271493,0.0
2024-02-21,Indian banks' rush for clients set for reckoning after Paytm fiasco | Finance News,Indian banks' rush for clients set for reckoning after Paytm fiasco Business Standard ...,https://www.business-standard.com/finance/news/indian-banks-rush-for-clients-set-for-reckoning-after-paytm-fiasco-124022100313_1.html,2024-02-21 06:37:24,Business Standard,-0.031419,0.0
2024-02-21,India banks' rush for clients set for reckoning after Paytm,"India stunned investors last month by abruptly suspending most activities of the banking affiliate of Paytm, a once high-flying fintech star that had attracted backing from Warren Buffett and SoftBank Group Corp.",https://www.moneycontrol.com/news/business/india-banks-rush-for-clients-set-for-reckoning-after-paytm-12319811.html,2024-02-21 06:15:27,Money Control,-0.031421,0.0
2024-02-22,Strategies To Enable High Performers Transform Organizations,"In an ideal scenario, high performers are celebrated for the value they bring to an organization and rewarded for their efforts through both promotion and pay. Unfortunately, corporate cultures can be marred by politics and conflicts. Examples abound. Steve Jobs was ousted from Apple.",https://www.forbes.com/sites/rajshreeagarwal/2024/02/22/strategies-to-enable-high-performers-transform-organizations/,2024-02-22 21:13:28,Forbes,0.246463,0.0
2024-02-22,I Went to a Rave With the 46-Year-Old Millionaire Who Claims to Have the Body of a Teenager,"The first few steps on the path toward living forever alongside the longevity enthusiast Bryan Johnson are straightforward: ""Go to bed on time, eat healthy food, and exercise,"" he told a crowd in Brooklyn on Saturday morning. ""But to start, you guys are now going to do a breathing exercise."" He ...",https://www.theatlantic.com/technology/archive/2024/02/bryan-johnson-dont-die-event/677535/,2024-02-22 20:46:17,The Atlantic,0.08163,0.0
2024-02-22,Can You Invest in Elon Musk's Neuralink?,"As Neuralink, which is registered as a medical research company, continues to make strides, investors are wondering how to get a piece of the action by investing in the neurotechnology venture. Because it is privately held, Neuralink isn't accessible to the average person - but that doesn't mean ...",https://investingnews.com/invest-neuralink-stock/,2024-02-22 21:30:00,Investing News Network,0.2088,0.0
2024-02-22,Cosmin Pitigoi to Join Flywire as Chief Financial Officer,"Former PayPal senior finance executive brings decades of experience and leadership across global payments, pricing, treasury, finance and investor relations Former PayPal senior finance executive brings decades of experience and leadership across global payments, pricing, treasury, finance and ...",https://www.globenewswire.com/news-release/2024/02/22/2833503/0/en/Cosmin-Pitigoi-to-Join-Flywire-as-Chief-Financial-Officer.html,2024-02-22 12:00:00,GlobeNewswire,0.236955,0.0
2024-02-22,Is Ethereum Fulfilling Its Potential as an Incredible Disruptor? 3 Reasons I'm Bearish,"This innovative crypto gets a lot of attention, but investors need to ask pressing questions.",https://www.fool.com/investing/2024/02/22/ethereum-incredible-disruptor-3-reasons-bearish/,2024-02-22 12:50:00,Motley Fool,0.227798,0.0
2024-02-23,1 Number PayPal Investors Won't Want to Miss,"PayPal's transaction margin is in decline, but the company has outlined several ways to get this back on track.",https://www.fool.com/investing/2024/02/23/1-number-paypal-investors-wont-want-to-miss/,2024-02-23 13:05:00,Motley Fool,0.204848,0.0
2024-02-23,"The Best Stocks to Invest $5,000 in Right Now",These stocks could be huge winners for long-term investors.,https://www.fool.com/investing/2024/02/23/the-best-stocks-to-invest-5000-in-right-now/,2024-02-23 10:50:00,Motley Fool,0.309195,0.0
2024-02-23,Are Retail Investors Interested In Crypto? JPMorgan Findings Differ From Google's,A recent price surge drove Bitcoin BTC/USD to multi-month highs - all thanks to a strong retail investor comeback. At least that's what a JPMorgan research report indicates.,https://www.benzinga.com/markets/cryptocurrency/24/02/37284238/are-retail-investors-interested-in-crypto-jpmorgan-findings-differ-from-googles,2024-02-23 17:57:52,Benzinga,0.164213,0.0
2024-02-23,"PayPal Holdings, Inc.  ( PYPL )  is Attracting Investor Attention: Here is What You Should Know","Paypal (PYPL) has been one of the stocks most watched by Zacks.com users lately. So, it is worth exploring what lies ahead for the stock.",https://www.zacks.com/stock/news/2230783/paypal-holdings-inc-pypl-is-attracting-investor-attention-here-is-what-you-should-know,2024-02-23 14:00:17,Zacks Commentary,0.208957,0.0
2024-02-23,A Once-in-a-Generation Investment Opportunity: 1 Artificial Intelligence  ( AI )  Growth Stock to Buy Now and Hold Forever,AI could dramatically change how we interact with technology. One company has been at the forefront of this shift for decades.,https://www.fool.com/investing/2024/02/23/a-once-in-a-generation-investment-opportunity-1-ar/,2024-02-23 13:45:00,Motley Fool,0.194567,0.0
2024-02-23,Here's how to avoid unexpected fees with payment apps,Regulators are considering changes to better protect consumers who use payment apps. It helps to know the fees involved to avoid costly scams.,https://www.cnbc.com/2024/02/23/heres-how-to-avoid-unexpected-fees-with-payment-apps.html,2024-02-23 13:00:01,CNBC,0.062304,0.0
2024-02-24,Peter Thiel doubles down on his program to pay kids not to stay in school,"That's the message billionaire Peter Thiel is sending as he extends a fellowship program that offers $100,000 to students willing to skip college and develop a company instead. Some in the latest cohort of applicants plan to launch projects related to the buzzy industries of AI and cryptocurrency.",https://africa.businessinsider.com/news/peter-thiel-doubles-down-on-his-program-to-pay-kids-not-to-stay-in-school/9b79mtt,2024-02-24 22:09:49,Business Insider,0.193769,0.0
2024-02-24,Peter Thiel doubles down on his program to pay kids not to stay in school,Peter Thiel doubles down on program to pay kids not to stay in school - Business Insider ...,https://www.businessinsider.com/peter-thiel-fellow-program-skip-woke-college-education-2024-2,2024-02-24 22:09:00,Business Insider,0.168733,0.0
2024-02-24,"Going Bargain Hunting? PayPal Is the Best Beaten-Down Stock to Buy in 2024, but Only If You Believe 1 Thing.",The leader in electronic payments deserves a closer look.,https://www.fool.com/investing/2024/02/24/bargain-hunting-paypal-best-stock-2024/,2024-02-24 13:45:00,Motley Fool,0.348497,0.0
2024-02-24,Here Are My Top 5 Undervalued Growth Stocks to Buy Right Now,The market is still full of great companies to buy.,https://www.fool.com/investing/2024/02/24/here-are-my-top-5-undervalued-growth-stocks-to-buy/,2024-02-24 12:15:00,Motley Fool,0.225144,0.0
2024-02-25,U.S. Money Supply Is Shrinking the Most Since the Great Depression. Is an Economic and Stock Market Meltdown on the Way?,M2 money supply contractions have led to economic turmoil in the past. But perhaps this time will be different.,https://www.fool.com/investing/2024/02/25/us-money-supply-is-shrinking-the-most-since-the-gr/,2024-02-25 10:50:00,Motley Fool,-0.24864,0.0
2024-02-26,"2 Growth Stocks to Buy Before They Soar 72% and 79%, According to Wall Street Analysts","If these Wall Street analysts are correct, PayPal and Salesforce could be very rewarding investments over the next year.",https://www.fool.com/investing/2024/02/26/2-growth-stocks-to-buy-before-soar-79-wall-street/,2024-02-26 11:01:00,Motley Fool,0.30944,0.0
2024-02-26,An abrupt exit at a Goldman Sachs-backed crypto bank spotlights the industry's tug-of-war with regulators,Crypto Bank Anchorage Seeks New Top Lawyer Amid Regulatory Scrutiny - Business Insider ...,https://www.businessinsider.com/anchorage-digital-crypto-bank-general-counsel-regulatory-scrutiny-2024-2,2024-02-26 10:31:00,Business Insider,0.140385,0.0
2024-02-26,"1 Fintech Stock to Buy in 2024 With 45% Upside, According to 1 Wall Street Analyst","PayPal stock has fallen from pandemic-era highs, but one Wall Street analyst sees potential for massive upside.",https://www.fool.com/investing/2024/02/26/1-fintech-stock-to-buy-in-2024-with-45-upside-acco/,2024-02-26 12:00:00,Motley Fool,0.177566,0.0
2024-02-26,Geoff Seeley Joins PayPal as Chief Marketing Officer,"Seeley brings over 25 years of global brand, digital, and performance marketing expertise to PayPal and its family of brands, including Venmo",https://www.prnewswire.com/news-releases/geoff-seeley-joins-paypal-as-chief-marketing-officer-302070466.html,2024-02-26 14:00:00,PR Newswire,0.381386,0.0
2024-02-26,"Buy Now Pay Later Global Market Opportunities and Strategies, 2032: Strategic Partnerships and Collaborations, Use of AI-Powered BNPL Services, New Product Launches, Integration With Cloud","Buy Now Pay Later Global Market Opportunities and Strategies, 2032: Strategic Partnerships and Collaborations, Use ... PR ...",https://www.prnewswire.com/news-releases/buy-now-pay-later-global-market-opportunities-and-strategies-2032-strategic-partnerships-and-collaborations-use-of-ai-powered-bnpl-services-new-product-launches-integration-with-cloud-302071131.html,2024-02-26 19:00:00,PR Newswire,0.154521,0.0
2024-02-27,Latest Gaming Industry Cuts: Sony Lays Off 900 PlayStation Employees,"Sony Interactive Entertainment, Sony's video game division, is laying off 900 employees across multiple PlayStation studios and will completely close its London studio, the company announced Tuesday, the latest in a series of layoffs that have impacted the video game industry.",https://www.forbes.com/sites/jamesfarrell/2024/02/27/sony-laying-off-900-playstation-employees-in-latest-gaming-industry-cuts/,2024-02-27 15:04:30,Forbes,-0.016611,0.0
